tmdb_id,imdb_id,title,release_date,language,rating_tmdb,rating_imdb,votes_imdb,revenue,director,cast,release_year
287767,tt3495000,Mardaani,22-08-2014,hi,6.6,7.3,15096,7600000,Pradeep Sarkar,"Rani Mukerji, Tahir Raj Bhasin, Jisshu Sengupta, Sanjay Taneja, Mona Ambegaonkar",2014
287859,tt3483712,Raja Natwarlal,29-08-2014,hi,6.4,6.2,5101,4,Kunal Deshmukh,"Emraan Hashmi, Humaima Malick, Paresh Rawal, Kay Kay Menon, Deepak Tijori",2014
289277,tt3099372,Victory,23-08-2013,kn,4.8,7.2,212,0,Nanda Kishore,"Sharan, Asmita Sood, P. Ravi Shankar, Tabla Nani, Avinash",2013
289393,tt4002168,Beware of Dogs,20-06-2014,ml,5.5,4.3,104,0,Vishnu Prasad,"Sreenath Bhasi, Jasmine Bhasin, Koottickal Jayachandran, Manoj K Jayan, Siju Wilson",2014
290386,tt3686242,Peruchazhi,29-08-2014,ml,3.6,4,1027,0,Arun Vaidyanathan,"Mohanlal, Mukesh, Vijay Babu, Ragini Nandwani, Aju Varghese",2014
290565,tt3885682,Hi I'm Tony,26-07-2014,ml,5,5.4,364,0,Lal Jr.,"Lal, Asif Ali, Miya George, Biju Menon, Lenaa",2014
291154,tt3398052,Daawat-e-Ishq,05-09-2014,hi,6.931,6.1,6463,0,Habib Faisal,"Aditya Roy Kapur, Parineeti Chopra, Anupam Kher, Karan Wahi, Aziz Rizwan",2014
291157,tt3554418,Khoobsurat,19-09-2014,hi,6.621,6.4,9575,0,Shashanka Ghosh,"Sonam Kapoor Ahuja, Fawad Khan, Kirron Kher, Ratna Pathak Shah, Aditi Rao Hydari",2014
291210,tt3949610,Poriyaalan,05-09-2014,ta,4,6.2,113,0,Thanukumar,"Harish Kalyan, Anandhi, Aadukalam Naren, Achyuth Kumar, Ajay Raj",2014
292139,tt3949638,Power,12-09-2014,te,5.7,5.8,1318,4900000,Bobby Kolli,"Ravi Teja, Hansika Motwani, Regina Cassandra, Prakash Raj, Mukesh Rishi",2014
292140,tt3949630,Anukshanam,12-09-2014,te,7.3,5.7,1278,0,Ram Gopal Varma,"Vishnu Manchu, Revathi, Kota Srinivasa Rao, Surya Bhagawan Das, Brahmanandam",2014
292349,tt3841400,Burma,12-09-2014,ta,3.8,6.4,272,0,Dharani Dharan,"Michael Thangadurai, Sampath Raj, Atul Kulkarni, Reshmi Menon, Kani Kusruti",2014
292830,tt3619854,Creature 3D,12-09-2014,hi,3.643,3.3,1823,42000000,Vikram Bhatt,"Bipasha Basu, Mukul Dev, Imran Abbas, Deepraj Rana, Bikramjeet Kanwarpal",2014
294655,tt4047112,Jeeva,26-09-2014,ta,7.1,8,2400,0,Suseenthiran,"Vishnu Vishal, Sri Divya, Soori, Lakshman Narayan, Harish Uthaman",2014
295379,tt4047132,Oru Oorla Rendu Raja,07-11-2014,ta,3.2,4.6,133,0,R. Kannan,"Vimal, Priya Anand, Soori, Nassar, Anupama Kumar",2014
295587,tt3982436,Loukyam,26-09-2014,te,5.7,6.4,1028,0,Sriwass,"Gopichand, Rakul Preet Singh, Sampath Raj, Brahmanandam, Prudhviraj",2014
295590,tt3802668,Govindudu Andarivaadele,01-10-2014,te,4.7,5.7,3172,0,Pasupuleti Krishna Vamsi,"Ram Charan, Prakash Raj, Srikanth, Kajal Aggarwal, Kamalinee Mukherjee",2014
295615,tt4087770,Balwinder Singh Famous Ho Gaya,30-09-2014,hi,2,3.3,82,0,Unknown,"Shantanu Mukherjee, Mika Singh, Gabriela Bertante, Anupam Kher, Rajpal Yadav",2014
296023,tt11585868,Super Ranga,19-09-2014,kn,2,5.7,64,0,Sadhu Kokila,"Upendra, Kriti Kharbanda, Raghu Mukherjee, Ramakrishna",2014
296632,tt4526822,Ulsaha Committee,02-05-2014,ml,3.5,3.2,164,0,Akku Akbar,"Jayaram, Isha Talwar, Kalabhavan Shajon, Sheela, Baburaj",2014
296690,tt3380264,Kill Dil,13-11-2014,hi,5.186,4.5,4700,8376879,Shaad Ali,"Ranveer Singh, Ali Zafar, Govinda, Parineeti Chopra, Brijendra Kala",2014
296902,tt4110972,Vellimoonga,25-09-2014,ml,7.403,7.6,2708,3700000,Jibu Jacob,"Biju Menon, Aju Varghese, Nikki Galrani, Tini Tom, Siddique",2014
297022,tt1047519,Red Swastik,08-06-2007,hi,2.5,2.9,252,0,Vinod Pande,"Sherlyn Chopra, Harsh Chhaya, Deepraj Rana, Deepshika Nagpal, Kuldeep Mallik",2007
297125,tt4047140,Poojai,22-10-2014,ta,5.467,5.4,1519,0,Hari,"Vishal Krishna, Shruti Haasan, Soori, Mukesh Tiwari, Sathyaraj",2014
297222,tt2338151,PK,18-12-2014,hi,7.697,8.1,221357,118920000,Rajkumar Hirani,"Aamir Khan, Anushka Sharma, Saurabh Shukla, Boman Irani, Sushant Singh Rajput",2014
297294,tt2332570,The Lost Tape,14-09-2012,hi,0,4.9,20,0,Rakshit Dahiya,"Ankuar Panchal, Esha Rajee, Monali Sehgal, Shaurya Singh, Nishantt Tanwar",2012
297809,tt2871010,Sonali Cable,17-10-2014,hi,5.2,5.3,1158,0,Charudutt Acharya,"Rhea Chakraborty, Ali Fazal, Anupam Kher, Smita Jaykar, Swanand Kirkire",2014
298157,tt2317135,Tamanchey,10-10-2014,hi,3.2,4.5,394,0,Navneet Behal,"Richa Chadha, Nikhil Dwivedi, Damandeep Singh Mann, Vijay Pande, Talib Mehdi",2014
298315,tt3847072,Ekkees Toppon Ki Salaami,10-10-2014,hi,5,6.1,597,0,Ravindra Gautam,"Anupam Kher, Neha Dhupia, Divyendu Sharma, Aditi Sharma, Sudhir Pandey",2014
298536,tt3399462,Oka Laila Kosam,17-10-2014,te,5.4,6,1170,100,Vijay Kumar Konda,"Naga Chaitanya Akkineni, Pooja Hegde, Ali Basha, Suman Talwar, Sayaji Shinde",2014
298654,tt3431342,Pithavum Kanyakayum,04-10-2013,ml,0,3.1,14,0,Rupesh Paul,"Sasi Kalinga, Krupa, M G Sasi",2013
299692,tt2630076,Super Nani,31-10-2014,hi,7.2,4.7,572,0,Indra Kumar,"Rekha, Sharman Joshi, Randhir Kapoor, Shweta Kumar, Anupam Kher",2014
300214,tt3885714,Karthikeya,24-10-2014,te,6.2,7.2,6900,0,Chandoo Mondeti,"Nikhil Siddhartha, Swathi Reddy, Praveen, Satya, Tanikella Bharani",2014
300425,tt4020624,Lingaa,12-12-2014,ta,5.2,5.6,6988,0,K. S. Ravikumar,"Rajinikanth, Anushka Shetty, Sonakshi Sinha, Santhanam, Karunakaran",2014
300506,tt4047126,Nerungi Vaa Muthamidathe,31-10-2014,ta,5.7,6.2,72,0,Lakshmi Ramakrishnan,"Shabeer Kallarakkal, Pia Bajpiee, Sruthi Hariharan, Viji Chandrasekhar, Thambi Ramaiah",2014
301115,tt3653728,Hangover,07-03-2014,ml,3,3.4,75,0,Sreejith Sukumaran,"Maqbool Salmaan, Shine Tom Chacko, Bhagath Manuel, Govind Krishna, Archana Gupta",2014
301668,tt4087914,Rowdy Fellow,21-11-2014,te,6.2,6.3,343,0,Krishna Chaitanya,"Nara Rohith, Vishakha Singh, Rao Ramesh, Venkateswara Rao Paruchuri, Posani Krishna Murali",2014
302141,tt3311236,Calapor,02-08-2013,hi,0,5.2,9,0,Dinesh P. Bhonsle,"Priyanshu Chatterjee, Rituparna Sengupta",2013
302170,tt1948047,Impatient Vivek,07-01-2011,hi,2,2.2,91,0,Rahat Kazmi,"Vivek Sudershan, Sayali Bhagat, Ronnaoq Ahuja, Chari Asopa, Hrishikesh Joshi",2011
302241,tt3046022,Whistle,12-07-2013,kn,7,5.7,59,0,Prashanth Raj,"Chiranjeevi Sarja, Pranitha Subhash, Guruprasad",2013
302473,tt0876126,Jai Santoshi Maa,29-09-2006,hi,5,7,70,0,Ahmed Siddiqui,"Nushrratt Bharuccha, Raqesh Bapat, Lalit Tiwari, Sanjay Swaraj, Shashi Sharma",2006
302638,tt4186118,Iyobinte Pusthakam,07-11-2014,ml,7.744,7.7,3281,0,Amal Neerad,"Fahadh Faasil, Lal, Jayasurya, Vinayakan, Jinu Joseph",2014
303089,tt2016845,Aagaah: The Warning,05-11-2011,hi,1,3.8,39,0,Karan Razdan,Unknown,2011
303266,tt2771824,Back Bench Student,15-03-2013,te,0,5.7,36,0,Madhura Sridhar Reddy,"Mahat Raghavendra, Pia Bajpiee, Archana Kavi, Brahmanandam, Sarath Babu",2013
303281,tt3017412,Happy Ending,21-11-2014,hi,5.314,5.4,4111,0,Krishna D.K.,"Saif Ali Khan, Ileana D'Cruz, Kalki Koechlin, Govinda, Ranvir Shorey",2014
303316,tt2999712,Gurudu,20-06-2013,te,0,7.5,24,0,Unknown,Unknown,2013
303350,tt6915006,Chandi: The Power of Woman,08-11-2013,te,0,7.1,23,0,V.Samudra,"Priyamani, Krishnam Raju, Vinod Kumar, Nagendra Babu, Ashish Vidhyarthi",2013
303732,tt4195522,Pilla Nuvvu Leni Jeevitham,14-11-2014,te,4.8,6,447,0,A.S. Ravi Kumar Chowdary,"Sai Durgha Tej, Regina Cassandra, Prakash Raj, Jagapati Babu, Shafi",2014
304791,tt3822606,Ra Ra Krishnayya,04-07-2014,te,5.667,5.1,221,0,Mahesh P,"Sundeep Kishan, Regina Cassandra, Jagapati Babu, Tanikella Bharani, Brahmaji",2014
305248,tt2035528,Hum Do Anjaane,01-01-2011,hi,0,4.3,24,0,Milind Swamy,Jackie Shroff,2011
305349,tt4112264,Paathshala,10-10-2014,te,0,7.2,109,0,Mahi V. Raghav,"Nandu Vijay Krishna, Sai Ronak, Anupriya Goenka, Sirisha Vanka, Surya Bhagawan Das",2014
305506,tt3726006,Appuchi Gramam,14-11-2014,ta,1.5,6.2,104,0,Vi Anand,"Praveen Kumar, Anusha Naik, Vigneshwaran Palanisamy, Swasika, Nassar",2014
305769,tt4187650,Trip to Bhangarh,22-04-2014,hi,3.2,2.6,335,0,Jitendra Pawar,"Manish Choudhary, Suzanna Mukherjee, Rohit Chaudhury, Piyush Raina, Rachit Behl",2014
305826,tt3171844,Ullasa Uthsaha,30-04-2010,kn,7.5,6.5,94,0,Devaraja Palan,"Ganesh, Yami Gautam Dhar, Sadhu Kokila, Vithika Sheru, Tulasi",2010
305887,tt3402730,Mahankali,08-03-2013,te,0,5.4,22,0,Kartikeya,"Kausha Rach, Dr. Rajasekhar, Nyra Banerjee, Annapoorna, Chalapathi Rao",2013
306283,tt12833264,Tourist Home,05-07-2013,ml,6.5,4.2,8,0,Shebi,"Meera Nandan, Hemanth Menon, Sreejith Vijay, Rejith Menon, Sreejith Ravi",2013
306383,tt3571378,Gajakessari,23-05-2014,kn,4.8,6.5,954,0,S. Krishna,"Yash, Amulya, John Vijay, Anant Nag, Prabhakar",2014
306469,tt4056974,Homely Meals,03-10-2014,ml,5.6,6.3,281,0,Anoop Kannan,"Vipin Atley, Manoj K Jayan, Nedumudi Venu, Srindaa, Neeraj Madhav",2014
306834,tt4221390,Kaadu,21-11-2014,ta,3,6.4,56,0,Stalin Ramalingam,"Vidharth, Samskruthy Shenoy, Thambi Ramaiah, Samuthirakani, Aadukalam Naren",2014
306965,tt1099998,Operation Duryodhana,31-05-2007,te,6,5.2,135,0,Posani Krishna Murali,"Srikanth, Kaveri, Mumaith Khan, Posani Krishna Murali, Gehana Vasisth",2007
307002,tt4047104,Enakkul Oruvan,06-03-2015,ta,6.8,7.6,1978,0,Prasath Ramar,"Siddharth, Deepa Sannidhi, Srushti Dange, Aadukalam Naren, John Vijay",2015
307030,tt0418880,Mere Jeevan Saathi,03-02-2006,hi,3,3.4,1109,0,Suneel Darshan,"Akshay Kumar, Karisma Kapoor, Ameesha Patel, Gulshan Grover, Ashish Vidhyarthi",2006
307211,tt3021244,Chaarfutiya Chhokare,26-09-2014,hi,0,5.6,62,0,Manish Harishankar,"Soha Ali Khan, Zakir Hussain, Seema Biswas, Mukesh Tiwari, Harsh Mayar",2014
307344,tt4417502,Shivam,02-10-2015,te,4.8,5.4,734,0,Sreenivasa Reddy,"Ram Pothineni, Raashii Khanna, Abhimanyu Singh, Brahmanandam, Jayaprakash Reddy",2015
307614,tt3916762,Rabhasa,28-08-2014,te,4.9,4.8,2275,0,Santosh Srinivas,"N.T. Rama Rao Jr., Samantha Ruth Prabhu, Pranitha Subhash, Brahmanandam, Jayasudha",2014
307615,tt2100613,Rey,27-03-2015,te,2,3.4,219,0,Y. V. S. Chowdary,"Sai Durgha Tej, Saiyami Kher, Shraddha Das, Farhad Shahnawaz, Arpit Ranka",2015
307729,tt3881384,Dandupalya,29-06-2012,kn,7,6.6,192,5800000,Srinivasa Raju,"Pooja Gandhi, Raghu Mukherjee, Priyanka Kothari, Makrand Deshpande, Ravi Kale",2012
307736,tt1795548,Alasyam Amrutham,03-12-2010,te,0,5.7,52,0,Chandra Mahesh,"Nikhil Siddhartha, Arvind Krishna, Madalasa Sharma",2010
307751,tt4176586,Brother of Bommali,08-10-2014,te,5,5.2,144,0,Chinni Krishna,"Allari Naresh, Karthika Nair, Monal Gajjar, Harshvardhan Rane, Brahmanandam",2014
307779,tt3401910,Okkadine,14-02-2013,te,0,5.7,99,0,Raga Srinivas,"Nara Rohith, Nithya Menen, Kota Srinivasa Rao, Brahmanandam",2013
307785,tt2780498,Tulasi Dalam,11-03-2016,te,0,5.1,18,0,R. P. Patnaik,Unknown,2016
307854,tt1601800,Anjani Putrudu,29-06-2009,te,0,6.2,9,0,K. Chandrasekhar,"Apoorva, Ramya Krishnan, Nagendra Babu, Prema, M. S. Narayana",2009
307970,tt1612112,Toss,14-07-2007,te,0,5.2,31,0,Unknown,"Upendra, Raja, Priyamani, Ali Basha, Kamna Jethmalani",2007
307973,tt3169676,Meinu Ek Ladki Chaahiye,26-09-2014,hi,3,3.6,21,0,Abhishek Bindal,"Raghubir Yadav, Puru Chibber, Reecha Sinha, Zakir Hussain, Yatin Karyekar",2014
307979,tt4112354,Rough,28-11-2014,te,4.5,4.3,142,0,C. H. Subba Reddy,"Aadi Saikumar, Rakul Preet Singh, Srihari, Brahmanandam, Raghu Babu",2014
308165,tt0403935,Action Jackson,05-12-2014,hi,4.346,3.4,4777,0,Prabhu Deva,"Ajay Devgn, Manasvi Mamgai, Byron Gibson, Sonakshi Sinha, Yami Gautam Dhar",2014
308257,tt4108632,Villali Veeran,06-09-2014,ml,2.7,2.6,298,0,Sudheesh Shankar,"Dileep, Nedumudi Venu, Namitha Pramod, Kalabhavan Shajon, Siddique",2014
308279,tt4305802,Ormayundo Ee Mukham,14-11-2014,ml,4.4,5.5,364,0,Anvar Sadik,"Vineeth Sreenivasan, Namitha Pramod, Aju Varghese, Rohini, Soumya Sadanandan",2014
308298,tt1463488,Raju Maharaju,19-06-2009,te,7,5.3,553,0,Unknown,"Mohan Babu, Sharwanand, Surveen Chawla, Ramya Krishnan, Nassar",2009
309158,tt2216852,Main Aur Mr. Riight,12-12-2014,hi,4.7,4.8,413,0,Adeeb Rais,"Barun Sobti, Shenaz Treasury, Kavi Shastri, Varun Khandelwal, Danny Sura",2014
309159,tt4235040,Mrugashira,15-05-2015,kn,7,4.5,28,0,Srivatsa,"Manasa Himavarsha, Prajwal Devaraj, Sadhu Kokila, Manasa, Thriller Manju",2015
309168,tt0833493,Love Ke Chakkar Mein,06-06-2006,hi,1,4.5,51,0,Unknown,Unknown,2006
309707,tt1252562,Khushboo: The Fragrance of Love,20-06-2008,hi,0,3.9,28,0,Rajesh Ram Singh,"Avantika, Thomas Tevana, Rishi Rehan, Nassar Abdulla",2008
309918,tt1900937,Mumbai Mast Kallander,14-01-2011,hi,0,6.8,13,0,Musavir Jaleel,"Shilpa Shukla, Ashraf Ul Haq, Rajendra Sethi, Rajesh Vivek",2011
310298,tt0476861,Sarhad Paar,23-11-2006,hi,0,3.9,148,0,Raman Kumar,"Mahima Chaudhry, Tabu, Sanjay Dutt, Chandrachur Singh, Rahul Dev",2006
310495,tt0454429,Chingaari,17-02-2006,hi,1.7,4.7,246,0,Kalpana Lajmi,"Sushmita Sen, Mithun Chakraborty, Ila Arun, Anuj Sawhney, Aanjjan Srivastav",2006
310633,tt1290507,Hanumanthu,01-06-2006,te,5,7.1,18,0,Chandra Mahesh,"Srihari, Pradeep Ram Singh Rawat, L. B. Sriram, K R Vijaya, Madhu Sharma",2006
310702,tt1563732,5 Ghantey Mien 5 Crore,10-08-2012,hi,0,5.6,92,0,Faisal Saif,Unknown,2012
311152,tt4306694,Kappal,25-12-2014,ta,4.4,6.1,584,0,Karthik G. Krish,"Vaibhav, Sonam Bajwa, Karunakaran, VTV Ganesh, Arjunan Nandakumar",2014
311155,tt4290746,Pisaasu,19-12-2014,ta,6.7,7.5,2618,1200000,Mysskin,"Naga, Prayaga Martin, Radha Ravi, Kalyani Natarajan, Harish Uthaman",2014
311162,tt3189026,Aaaah,28-11-2014,ta,5.9,5,143,0,Hareesh Narayan,"Gokulnath, Meghna, Balasaravanan, Bobby Simha, M. S. Bhaskar",2014
312056,tt2708644,I Love NY,10-07-2015,hi,4.6,3.4,944,0,Radhika Rao,"Kangana Ranaut, Sunny Deol, Prem Chopra, Kubbra Sait, Reema Lagoo",2015
312324,tt4898036,Joru,07-11-2014,te,6.3,4.7,132,0,Kumar Nagendra,"Sundeep Kishan, Raashii Khanna, Priya Banerjee, Brahmanandam, Sushma Raj",2014
312748,tt4339026,Thomson Villa,21-02-2014,ml,5,6.2,40,0,Abin Jacob,"Ananya, Hemanth Menon, Sarayu Mohan, Innocent, Lenaa",2014
313430,tt0875692,Aggar,14-09-2007,hi,3.5,4.3,318,0,Ananth Narayan Mahadevan,"Tusshar Kapoor, Udita Goswami, Shreyas Talpade, Sophiya Chaudhary, Nauheed Cyrusi",2007
314389,tt3848892,Baby,23-01-2015,hi,6.817,7.9,63023,0,Neeraj Pandey,"Akshay Kumar, Anupam Kher, Kay Kay Menon, Rana Daggubati, Danny Denzongpa",2015
314690,tt2361746,Haraamkhor,02-11-2015,hi,5.559,6.3,4717,0,Shlok Sharma,"Nawazuddin Siddiqui, Shweta Tripathi Sharma, Trimala Adhikari, Harish Khanna, Mohammad Samad",2015
314693,tt5531618,The Strange Case of Shiva,01-11-2015,ta,0,6.8,53,0,Arun Karthick,"Rajesh Balachandiran, Kani Kusruti, Chinnu Kuruvila, Sridhar Pushpavanam",2015
315009,tt2807410,Rudhramadevi,09-10-2015,te,5.171,5.6,3844,0,Gunasekhar,"Anushka Shetty, Allu Arjun, Rana Daggubati, Nithya Menen, Catherine Tresa",2015
315170,tt4305752,Mukunda,26-12-2014,te,6.429,5.6,669,0,Srikanth Addala,"Varun Tej, Rao Ramesh, Prakash Raj, Ali Basha, Pooja Hegde",2014
315453,tt3737442,Oraalppokkam,02-10-2015,ml,5.333,6.7,127,0,Sanal Kumar Sasidharan,"Prakash Bare, Meena Kandasamy, Venkitesh Ramakrishnan, Bikramjit Guptha, Chala Chari",2015
315934,tt3850358,Alludu Seenu,25-07-2014,te,5.7,4.7,816,8,V. V. Vinayak,"Bellamkonda Srinivas, Samantha Ruth Prabhu, Brahmanandam, Prakash Raj, Pradeep Ram Singh Rawat",2014
316437,tt1709731,Soul of Sand,15-01-2011,hi,2.3,5.8,111,0,Sidharth Srinivasan,"Dibyendu Bhattacharya, Saba Joshi",2011
316560,tt3319128,Manipulated by Fingers,09-02-2013,ml,8,8.1,25,0,Prasanth Vijay,"Nelliyodu Vasudevan Namboothiri, Arun Sadanandan, Nikhil Narendran, Rakesh Konni",2013
316654,tt2979920,Bombay Velvet,15-05-2015,hi,5.424,5.5,6771,1500000,Anurag Kashyap,"Ranbir Kapoor, Anushka Sharma, Karan Johar, Kay Kay Menon, Satyadeep Misra",2015
316840,tt0897413,Bhoot Unkle,06-10-2006,hi,7,4.8,438,0,Mukesh Saigal,"Jackie Shroff, Akhilendra Mishra",2006
316841,tt2177513,Chaloo Movie,23-12-2011,hi,6.5,4.6,71,0,Vinod Pande,"Rajpal Yadav, Shekhar Suman, Divya Dutta, Hrishitaa Bhatt, Gulshan Grover",2011
316846,tt3056632,Manjunath,09-05-2014,hi,7,7.1,526,0,Sandeep A. Verma,"Anjori Alagh, Seema Biswas, Divya Dutta, Satiiysh Saarathy Sasho, Asif Basra",2014
316900,tt2976182,Roy,11-02-2015,hi,4.741,3.2,8204,5400,Vikramjit Singh,"Arjun Rampal, Jacqueline Fernandez, Ranbir Kapoor, Abhijeet Singh, Shernaz Patel",2015
317781,tt0461323,Pyare Mohan,21-04-2006,hi,4.5,3.5,1078,0,Indra Kumar,"Fardeen Khan, Vivek Oberoi, Esha Deol, Amrita Rao, Boman Irani",2006
318564,tt0896817,Inspector Garud,29-01-2007,ml,3.8,4.3,336,0,Johny Antony,"Dileep, Kavya Madhavan, Vijayaraghavan, Innocent, Cochin Haneefa",2007
318773,tt0808904,Pachakuthira,14-04-2006,ml,4.4,4.7,473,0,Kamal,"Dileep, Gopika, Salim Kumar, Kalasala Babu, Mamukkoya",2006
318791,tt4339122,Uchithanai Muharnthaal,16-12-2011,ta,0,8.1,11,0,Pugazhenthi Thangaraj,"Neenika, Sathyaraj, Seeman, Nassar, Sangeetha Krish",2011
318848,tt4107858,MSG: The Messenger of God,16-01-2015,hi,3,5.8,11423,0,Gurmeet Ram Rahim Singh,"Gurmeet Ram Rahim Singh, Daniel Kaleb, Jayshree Soni, Flora Saini",2015
318941,tt4087850,Darling,15-01-2015,ta,5.962,6,1080,0,Sam Anton,"G. V. Prakash Kumar, Nikki Galrani, Karunas, Balasaravanan, Srushti Dange",2015
319832,tt10638296,Guna 369,02-08-2019,te,5.7,6.2,542,0,Arjun Jandyala,"Kartikeya Gummakonda, Anagha, Adithya Menon, Shivaji Raja, Sai Kumar",2019
319962,tt2014263,Kavya's Diary,05-06-2009,te,0,4.6,28,0,V. K. Prakash,"Indrajith Sukumaran, Manjula Ghattamaneni, Charmy Kaur, Shashank, Satyam Rajesh",2009
320024,tt4332114,Dolly Ki Doli,23-01-2015,hi,5.167,4.6,3371,0,Abhishek Dogra,"Sonam Kapoor Ahuja, Pulkit Samrat, Rajkummar Rao, Varun Sharma, Mohammed Zeeshan Ayyub",2015
320742,tt1309592,Kurukshetra,08-10-2008,ml,5.2,5.7,477,0,Major Ravi,"Mohanlal, Siddique, Biju Menon, Ravi Mariya, Sania Singh",2008
320902,tt1354034,Mithileya Seetheyaru,01-01-2014,kn,0,6.8,25,0,Unknown,Unknown,2014
320906,tt4448310,Orange Mittai,31-07-2015,ta,5.9,6.5,900,0,Biju Viswanath,"Vijay Sethupathi, Aashritha, Ramesh Thilak, Arumugam Bala, Karunakaran",2015
320910,tt5128328,Naanum Rowdydhaan,21-10-2015,ta,6.4,7.2,5644,0,Vignesh Shivan,"Vijay Sethupathi, Nayanthara, RJ Balaji, R. Parthiban, Radikaa Sarathkumar",2015
321162,tt3726018,Hrudaya Kaleyam,04-04-2014,te,3.5,5.5,433,0,Sai Rajesh Neelam,"Sampoornesh Babu, Kavya Kumar, Ishika Singh, Kathi Mahesh",2014
321747,tt4373886,Sharafat Gayi Tel Lene,16-01-2015,hi,2.7,5,329,0,Gurmmeet Singh,"Talia Bentson, Tina Desai, Zayed Khan, Anupam Kher, Rannvijay Singha",2015
321793,tt4094820,Crazy Cukkad Family,15-01-2015,hi,0,5,65,0,Ritesh Menon,"Swanand Kirkire, Shilpa Shukla, Kushal Punjabi, Siddharth Sharma, Praveena Deshpande",2015
322012,tt3780532,Bhadaas,27-12-2013,hi,1,2.4,35,0,Ajay Yadav,"Meera Naveed, Ashutosh Kaushik, Aryeman Ramsay, Shree Rajput, Ananth Narayan Mahadevan",2013
322173,tt4306300,Mr & Mrs Ramachari,25-12-2014,kn,6.4,7.3,2792,780000,Santhosh Ananddram,"Yash, Radhika Pandit, Achyuth Kumar, Srinath, Malavika Avinash",2014
322178,tt3875512,Vaastu Prakaara,01-05-2015,kn,4,5.6,261,0,Yogaraj Bhat,"Jaggesh, Rakshit Shetty, Aishani Shetty, Parul Yadav, Anant Nag",2015
322286,tt1580017,Ride,05-06-2009,te,5,5.3,272,0,Ramesh Varma,"Tanish Alladi, Nani, Shweta Basu Prasad, Aksha Pardasany, Aadarsh Balakrishna",2009
322359,tt4501288,Mylanchi Monchulla Veedu,28-11-2014,ml,4.7,4.7,213,0,Benny P Thomas,"Jayaram, Asif Ali, Kaniha, Meera Nandan, Madhu",2014
322954,tt10127798,Inba,21-03-2008,ta,0,5.1,15,0,Vendhan,"Shaam, Sneha, C. Arun Pandian, Aravind Akash, Rekha",2008
323011,tt9042310,Manathodu Mazhaikalam,22-09-2006,ta,0,7.1,26,0,Arputhan,"Shaam, Nithya Das, Sameksha Oswal, Jayasurya, T. P. Gajendran",2006
323053,tt2872050,Jai Jawaan Jai Kisaan,06-02-2015,hi,0,5.4,36,0,Unknown,Unknown,2015
323148,tt14337938,Tananam Tananam,24-11-2006,kn,0,5,8,0,Kavitha Lankesh,"Shaam, Divya Spandana, Rakshita, Girish Karnad, Bharathi Rao",2006
323178,tt3666944,Newtonin Moondram Vidhi,01-05-2009,ta,6.6,6.5,60,0,Thai Muthuselvan,"S. J. Suryah, Sayali Bhagat, Rajiv Krishna, Yugendran, Thalaivasal Vijay",2009
323289,tt4125324,@Andheri,14-02-2014,ml,0,4.3,15,0,Biju Bhaskar Nair,"Atul Kulkarni, Bineesh Kodiyeri, Sreenivasan, Disney James, Aparna Nair",2014
323517,tt3678782,Badlapur,20-02-2015,hi,6.997,7.4,28570,11480000,Sriram Raghavan,"Varun Dhawan, Nawazuddin Siddiqui, Huma Qureshi, Yami Gautam Dhar, Divya Dutta",2015
324005,tt6821932,Sutrula,19-12-2014,ta,0,7.3,17,0,V. Rajesh Alfred,"Richard Rishi, Mithun Maheshwaran, Prajin Padmanabhan, Ankitha, Srija",2014
324344,tt3565354,Karar: The Deal,24-01-2014,hi,0,4.2,81,202593,Sabir,"Maheck Chahal, Tarun Arora, Jyothi Rana",2014
324759,tt2254124,Thalsamayam Oru Penkutty,02-03-2012,ml,4,3.6,151,0,T. K. Rajeev Kumar,"Nithya Menen, Shweta Menon, Unni Mukundan, Maniyanpilla Raju, KPAC Lalitha",2012
325138,tt3495030,Dum Laga Ke Haisha,27-02-2015,hi,7.181,7.4,22365,0,Sharat Katariya,"Bhumi Pednekar, Ayushmann Khurrana, Sheeba Chaddha, Sanjay Mishra, Seema Pahwa",2015
325699,tt4442758,Temper,13-02-2015,te,6.4,7.4,8730,11600000,Puri Jagannadh,"N.T. Rama Rao Jr., Kajal Aggarwal, Prakash Raj, Posani Krishna Murali, Nyra Banerjee",2015
325722,tt3898180,Thirupathi Express,05-09-2014,kn,2,5.9,84,0,Pon Kumaran,"Kriti Kharbanda, Sumanth Shailendra, Ashok, Sadhu Kokila, Bullet Prakash",2014
326153,tt4431392,Malli Malli Idhi Rani Roju,06-02-2015,te,7.208,7.5,1498,0,Kranthi Madhav,"Sharwanand, Nithya Menen, Pavitra Lokesh, Pavani Gangireddy, Nassar",2015
326405,tt1893409,Ye Stupid Pyar,09-12-2011,hi,0,5.8,14,0,Unknown,Unknown,2011
326449,tt3107818,Sidlingu,13-01-2012,kn,8,7.3,154,0,Vijaya Prasad,"Yogesh, Divya Spandana",2012
326490,tt2404187,Bloody Isshq,01-03-2013,hi,5,7.7,52,0,Arup Dutta,"Daisy Shah, Shilpa Anand, Tripta Parashar, Mukesh Tiwari, Karan Mehra",2013
326903,tt2375567,Super Model,27-09-2013,hi,1,1.9,216,0,Naveen Batra,"Prabha Ali, Wahid Ali, Ashmit Patel, Harsh Chhaya, Bobby Darling",2013
327539,tt4507184,Good Bad & Ugly,13-12-2013,ml,3.5,3.7,27,0,Rathish Ram,"Meghana Raj, Sreejith Vijay, Bipin Basil Paulose, Sanju Sivaram, Suraj Venjaramoodu",2013
327560,tt1102308,Pulijanmam,01-05-2006,ml,0,7.4,48,0,Priyanandanan,"Murali, Sindhu Menon, Vineeth Kumar, Samvrutha Sunil",2006
327709,tt4546024,Komban,27-03-2015,ta,5.111,5.8,1055,0,M. Muthaiah,"Karthi, Lakshmi Menon, Rajkiran, Super Subbarayan, I. M. Vijayan",2015
327904,tt4295578,Aamayum Muyalum,19-12-2014,ml,2.9,3.4,263,0,Priyadarshan,"Nedumudi Venu, Innocent, Jayasurya, Mamukkoya, Nandhu",2014
327905,tt3542028,Chal Bhaag,13-06-2014,hi,4,3.6,118,0,Prakash Saini,"Deepak Dobriyal, Samiksha Gaur",2014
328322,tt4835658,Alif,27-02-2015,ml,5,7.3,47,0,N K Muhammed Koya,"Lenaa, Kalabhavan Mani, Irshad, Nedumudi Venu, Zeenath",2015
328376,tt4415316,Touring Talkies,30-01-2015,ta,4,3,38,0,S. A. Chandrasekhar,"S. A. Chandrasekhar, Manobala, Robo Shankar, Sunu Lakshmi, Vijay Vishwa",2015
328931,tt3666258,Coffee Bloom,06-03-2015,hi,0,5.7,145,0,Manu Warrier,"Ishwari Bose-Bhattacharya, Sugandha Garg, Mohan Kapur, Arjun Mathur, Sharath Parvathavani",2015
329134,tt4328798,Massu Engira Maasilamani,29-05-2015,ta,5,5.9,5464,0,Venkat Prabhu,"Suriya, Nayanthara, Pranitha Subhash, Premji Amaran, R. Parthiban",2015
329135,tt4271820,O Kadhal Kanmani,16-04-2015,ta,7,7.4,7986,5100000,Mani Ratnam,"Dulquer Salmaan, Nithya Menen, Prakash Raj, Leela Samson, Vinodhini Vaidyanathan",2015
329138,tt4425388,Pulan Visaranai 2,30-01-2015,ta,3,6.5,40,0,R K Selvamani,"Prashanth, Karthika Mathew, Aswini, Mansoor Ali Khan, R. K.",2015
329591,tt4448372,Nannbenda,02-04-2015,ta,3.955,3.8,548,0,Jagadish,"Udhayanidhi Stalin, Nayanthara, Santhanam, Karunakaran, Sherin Shringar",2015
329727,tt1754833,Vakratunda Swaha,01-01-2010,hi,7,6.4,42,0,Ashish Avikunthak,"Girish Dahiwale, Debu Pramanik, Ashish Avikunthak, Swapan Pramanik, Radhika Apte",2010
329828,tt13667308,Karuppusamy Kuththagaithaarar,14-05-2007,ta,7,6.7,27,0,Murthy Krishna,"Karan, Meenakshi, Vadivelu, Ambani Shankar, Venba",2007
330013,tt1810528,Adv. Lakshmanan - Ladies Only,27-07-2010,ml,5,2.6,45,0,Pappan Payattuvila,"Mukesh, Jagadish, Harisree Ashokan, Shivaji Guruvayoor, Mallika Kapoor",2010
330149,tt0470614,Yun Hota To Kya Hota,21-07-2006,hi,6.2,6.4,801,0,Naseeruddin Shah,"Konkona Sen Sharma, Irrfan Khan, Ayesha Takia, Jimmy Shergill, Paresh Rawal",2006
330218,tt1820446,Four Friends,28-10-2010,ml,4.1,3.8,313,0,Saji Surendran,"Jayaram, Kunchacko Boban, Jayasurya, Meera Jasmine, Kamal Haasan",2010
330399,tt4446318,Rajathandhiram,13-03-2015,ta,6.6,7.6,1561,0,A. G. Amid,"Veera Bahu, Regina Cassandra, Pattiyal K. Shekar, Darbuka Siva, Ilavarasu",2015
330403,tt4519830,Vaanavil Vaazhkai,13-03-2015,ta,3,4.9,24,0,James Vasanthan,"Jose Selvaraj, Janani Rajan, Shilvi Sharon, Jithin Raj, Cassandra Rachel",2015
330414,tt5128266,10 Endrathukulla,21-10-2015,ta,4.5,5.2,1814,0,S. D. Vijay Milton,"Vikram, Samantha Ruth Prabhu, Pasupathy, Abhimanyu Singh, Manobala",2015
330415,tt4903366,Idhu Enna Maayam,31-07-2015,ta,5.4,5.6,463,0,A. L. Vijay,"Vikram Prabhu, Keerthy Suresh, Kavya Shetty, Ambika, Navdeep",2015
330424,tt8595874,Chennai Ungalai Anbudan Varaverkiradhu,10-04-2015,ta,5,5,16,0,M. Maruthupandian,"Bobby Simha, Saranya, Prabanjeyan, Linga, Alphonse Puthren",2015
330428,tt4112208,Kuttram Kadithal,25-09-2015,ta,6.7,7.8,849,0,Bramma G,"Master Ajay, Radhika Prasidhha, Sai Rajkumar, Pavel Navageethan, Kulothungan Udayakumar",2015
330467,tt1745753,Life Express,17-09-2010,hi,5.5,4.6,59,0,Anup Das,"Rituparna Sengupta, Divya Dutta, Kiran Janjani, Yashpal Sharma, Alok Nath",2010
330492,tt1569356,Bhagavan,01-05-2009,ml,2.2,2.3,296,0,Prashanth Mambully,"Mohanlal, Daniel Balaji, Lakshmi Gopalaswamy, Shivaji Guruvayoor, Ibrahim Kutty",2009
330494,tt1084672,College Kumaran,02-02-2008,ml,2.4,2.6,439,0,Thulasidas,"Mohanlal, Harisree Ashokan, Vimala Raman, Balachandra Menon, Kalasala Babu",2008
330498,tt1671456,Drona 2010,27-01-2010,ml,4.875,4.6,522,0,Shaji Kailas,"Mammootty, Thilakan, Manoj K Jayan, Kaniha, Navya Nair",2010
330503,tt1105726,Flash,27-12-2007,ml,3.5,3.2,263,0,Sibi Malayil,"Mohanlal, Parvathy Thiruvothu, Indrajith Sukumaran, Jagathy Sreekumar, Poorna",2007
330505,tt1645757,Gulumaal: The Escape,13-03-2009,ml,5.938,5.2,316,0,V. K. Prakash,"Kunchacko Boban, Jayasurya, Devan, Mithra Kurian, Suraj Venjaramoodu",2009
