tmdb_id,imdb_id,title,release_date,language,rating_tmdb,rating_imdb,votes_imdb,revenue,director,cast,release_year
513394,tt7050870,Rajaratha,23-03-2018,kn,6.2,5.1,280,0,Anup Bhandari,"Nirup Bhandari, Avantika Shetty, P. Ravi Shankar, Arya, Sruthi Hariharan",2018
513540,tt7384848,Missing,06-04-2018,hi,6.094,5.8,2584,0,Mukul Abhyankar,"Manoj Bajpayee, Tabu, Annu Kapoor, Shruti Gupta",2018
514691,tt7168116,Irupuram: Two Sides,14-11-2017,ml,0,8.6,9,0,P.V.Vippin,Krishnan Potti,2017
514700,tt7415646,Tarak,29-09-2017,kn,6.4,6.7,798,0,Prakash Veer,"Darshan Thoogudeepa Srinivas, Sruthi Hariharan, Shanvi Shrivastava, Devaraj, Kuri Prathap",2017
514704,tt7822496,Idi Naa Love Story,14-02-2018,te,6,5.3,31,0,M Ramesh,"Tarun, Oviya Helen, Manchu Manoj",2018
514735,tt31259265,Mr. Bean,21-07-2013,ml,4,5,8,0,Reji Paul,"Divyadarshan, Avanthika Mohan, Bijukuttan, Kochu Preman, Pritam Kagne",2013
515194,tt8171022,Ishq Tera,20-04-2018,hi,0,6.1,40,0,Jojo D'Souza,"Hrishitaa Bhatt, Shahbaz Khan",2018
515206,tt7201112,Mum,11-08-2017,hi,0,8.5,20,0,Akash Mihani,Gunn Mihani,2017
515851,tt6834466,Samhaara,09-02-2018,kn,5,6.2,78,0,Unknown,"Chiranjeevi Sarja, Hariprriya, Chikkanna, Kavya Shetty",2018
515856,tt8001954,Churikatte,26-01-2018,kn,8,7.5,29,0,Raghu Shivamogga,"Praveen Tej, Achyuth Kumar, Sharath Lohitashwa, Balaji Manohar, Aruna Balaraj",2018
516063,tt7222598,Raju Kannada Medium,19-01-2018,kn,6.2,7,391,0,Naresh Kumar,"Gurunandan, Avantika Shetty, Ashika Ranganath, Sudeepa, Kuri Prathap",2018
516338,tt7928342,Tritiya,01-01-2017,ml,1.667,8.4,11,0,Vishnu Prasad,Unknown,2017
516533,tt4957164,Vascodigama,23-10-2015,kn,0,8.4,38,0,Madhu Chandra,"Kishore, Parvatii Nair, Suchendra Prasad, Sundar, Rockline Sudhakar",2015
517181,tt6861286,Khujli,31-03-2017,hi,1,6.6,204,0,Sonam Nair,"Jackie Shroff, Neena Gupta, Rani Patwar, Archak Chhabra",2017
517508,tt8072400,Hello Guru Prema Kosame,18-10-2018,te,6.3,7.1,3753,5479646,Trinadha Rao Nakkina,"Ram Pothineni, Anupama Parameswaran, Prakash Raj, Pranitha Subhash, Posani Krishna Murali",2018
517652,tt7058048,The Fish Curry,31-01-2017,hi,4,6.1,114,0,Abhishek Verma,"Suraj Ghosh, Abhishek Verma, Ajay Singhal, Deepa Kumar, Amar Chaudhary",2017
518972,tt6543110,Chhota Bheem aur Krishna: Pataliputra - City of the Dead,27-09-2009,hi,10,8.1,281,0,Rajiv Chilaka,"Vatsal Dubey, Julie Tejwani, Rupa Bhimani, Jigna Bhardwaj, Rajesh Kava",2009
519346,tt7450346,Panchavarnathatha,14-04-2018,ml,6.1,5.6,587,2100000,Ramesh Pisharody,"Jayaram, Kunchacko Boban, Anusree Nair, Mallika Sukumaran, Dharmajan Bolgatty",2018
519965,tt8537758,Villavan,19-04-2018,ta,6,6.2,20,0,Vassan,"Vinod Mohana Sundaram, Sangeeta Krishnasamy, Logan Nathan, Mathialagan, Bala Ganapathi William",2018
520176,tt5584426,Ishtakamya,13-05-2016,kn,6,6.1,69,0,Nagathihalli Chandrashekar,"Mayuri Kyatari, Vijay Suriya, Kavya Shetty, Suman Nagarkar, Prakash Belawadi",2016
520393,tt8047208,Taxiwala,01-06-2018,te,5.9,6.8,4850,0,Rahul Sankrityan,"Vijay Deverakonda, Priyanka Jawalkar, Malavika Nair, Ravi Prakash, Uttej",2018
520430,tt8823390,Bal Ganesh 2,23-10-2009,hi,9,6.6,196,0,Pankaj Sharma,Unknown,2009
521080,tt8223250,Bioscopewala,25-05-2018,hi,7,7.5,1083,0,Deb Medhekar,"Danny Denzongpa, Geetanjali Thapa, Adil Hussain, Tisca Chopra, Maya Sarao",2018
521390,tt1102335,Soorya Kireedam,30-04-2007,ml,2,4.9,24,0,George Kithu,"Indrajith Sukumaran, Remya Nambeesan, Nithya Das, Mamukkoya, Nishanth Sagar",2007
521400,tt1881010,Milana,14-09-2007,kn,7.3,8.3,1516,0,Prakash Veer,"Puneeth Rajkumar, Pooja Gandhi, Parvathy Thiruvothu, Dileep Raj, Sumithra",2007
521714,tt3996396,Yatra,08-02-2019,te,6.7,7.6,4001,0,Mahi V. Raghav,"Mammootty, Suhasini Maniratnam, Jagapati Babu, Ashrita Vemuganti, Rao Ramesh",2019
521854,tt7557024,Aravindante Athidhikal,27-04-2018,ml,6.667,7.1,1709,0,M. Mohanan,"Vineeth Sreenivasan, Sreenivasan, Nikhila Vimal, Urvashi, Aju Varghese",2018
521858,tt7919688,Veerathevan,19-01-2018,ta,0,6,8,0,Veeran Selvarasu,"Kaushik, Meenalotchani, Karate Gopalan",2018
522621,tt7702336,Chanakyathanthram,03-05-2018,ml,3.2,5.2,553,0,Kannan Thamarakkulam,"Unni Mukundan, Anoop Menon, Shruti Ramachandran, Sshivada Nair, Hareesh Perumanna",2018
523030,tt13218562,Varmaa,06-10-2020,ta,2.3,4,218,0,Bala,"Dhruv Vikram, Megha Chowdhury, Easwari Rao, Raiza Wilson, Sandra Amy",2020
523192,tt5749012,Mehsampur,12-05-2018,hi,4.5,6.2,97,0,Kabir Singh Chowdhry,"Lal Chand, Navjot Randhawa, Devrath Joshi, Jagjeet Sandhu, Kesar Singh Tikki",2018
523212,tt2016942,Meri Life Mein Uski Wife,16-10-2009,hi,2,5,43,0,Partho Ghosh,"Jatin Grewal, Hina Tasleem, Vikas Kalantri, Shakti Kapoor, Rocky Sandhu",2009
523278,tt8108206,Saand Ki Aankh,25-10-2019,hi,7,7.5,6351,0,Tushar Hiranandani,"Taapsee Pannu, Bhumi Pednekar, Prakash Jha, Pawan Chopra, Kuldeep Sareen",2019
523762,tt7458714,Mehbooba,11-05-2018,te,5,4.7,383,0,Puri Jagannadh,"Murali Sharma, Neha Shetty, Vishu Reddy, Akash Puri",2018
523851,tt4760900,Aisa Yeh Jahaan,24-07-2015,hi,7,6.9,64,0,Unknown,"Palash Sen, Ira Dubey, Yashpal Sharma, Tinnu Anand, Carol Gracias",2015
524025,tt8076418,Asuravadham,29-06-2018,ta,4.714,6.4,388,0,M. Maruthupandian,"M. Sasikumar, Nandita Swetha, Vasumithra, Sreejith Ravi, Namo Narayana",2018
524161,tt6745536,Nenorakam,17-03-2017,te,0,6.2,23,0,Sudershan Salendra,"Arjun Kolishetty, R. Sarathkumar, Sairam Shankar",2017
524478,tt7959952,Premasoothram,11-05-2018,ml,5.7,5.7,128,0,Jiju Asokan,"Chemban Vinod Jose, Balu Varghese, Lijomol Jose, Sudheer Karamana, Anumol",2018
524571,tt6944060,Naam,11-05-2018,ml,3,4.4,142,0,Joshy Thomas Pallickal,"Shabareesh Varma, Rahul Madhav, Gayathri Suresh, Mareena Michael, Madan Mohan",2018
524965,tt4888138,Lucky Jokers,29-04-2011,ml,3,3.6,23,0,Sunil,"Anoop Menon, Suraj Venjaramoodu, Jagathy Sreekumar, Ajmal Ameer, Jagadish",2011
525162,tt6982254,To Let,21-02-2019,ta,7,7.9,891,0,Chezhian Ra,"Santhosh Nambirajan, Sheela Rajkumar, Dharun, Aadhira Pandilakshmi",2019
525184,tt8108210,Hyderabad Love Story,23-02-2018,te,0,6.9,21,0,Satya,"Rahul Ravindran, Reshmi Menon, Sija Rose, Rao Ramesh, Jia",2018
525235,tt6514218,Noblemen,28-06-2019,hi,4.571,5.6,384,0,Vandana Kataria,"Ali Haji, Kunal Kapoor, Muskkaan Jaferi, Mohammed Ali Mir, Ivan Rodrigues",2019
525869,tt7698922,Her First Time,10-05-2018,hi,7.3,7.8,27,0,Divya Unny,"Trimala Adhikari, Vishwas Kini",2018
526078,tt6925128,Eluka Majaaka,26-02-2016,te,6,4.8,57,0,Narasimha Rao Relangi,"Brahmanandam, Vennela Kishore, Harsha Krishna Murthy, Raghu Babu, Pavani Reddy",2016
526079,tt8197158,Amutha,16-05-2018,ta,0,6.5,23,0,P. S. Arjun,"Sriya Sree, Anees Shaz, Levin Simon Joseph, Ashna Sudheer, Shivakumar Raju",2018
526133,tt7260848,Khajoor Pe Atke,18-05-2018,hi,0,5.9,343,0,Harsh Chhaya,"Vinay Pathak, Manoj Pahwa, Suneeta Sengupta, Sanah Kapoor, Boman Irani",2018
526191,tt9049540,LKG,22-02-2019,ta,6.526,6.9,1705,0,K. R. Prabhu,"RJ Balaji, Priya Anand, Ananth Vaidyanathan, J. K. Rithesh, Manobala",2019
526421,tt8435334,Seyal,18-05-2018,ta,0,5.4,10,0,Ravi Appulu,"Tharushi, Rajan Tejeshwar",2018
526671,tt8254196,The Change,01-01-2016,ml,0,9.1,8,0,Nirmal Baby Varghese,"Aswin Sreenivasan, Arun Kumar Panayal",2016
526770,tt8269204,Ammammagarillu,24-05-2018,te,0,5.4,237,0,Sundar Surya,"Naga Shaurya, Shamili, Sumithra, Shivaji Raja, Rao Ramesh",2018
526772,tt8133888,Nela Ticket,24-05-2018,te,4.6,4.3,1023,0,Kalyan Krishna,"Ravi Teja, Jagapati Babu, Malavika Sharma, Sampath Raj, Brahmanandam",2018
526983,tt6034076,Sipaayi,23-09-2016,kn,0,6.4,19,0,Rajath Mayee,"Siddharth Mahesh, Sruthi Hariharan, Sanchari Vijay, Achyuth Kumar, Gaurish Akki",2016
526984,tt6417762,Happy New Year,05-05-2017,kn,0,7.1,47,0,Pannaga Bharana,"B. C. Patil, Sai Kumar, Vijay Raghavendra, Diganth Manchale, Dhananjay",2017
527511,tt6129302,Bhavesh Joshi Superhero,01-06-2018,hi,7.4,7.6,11371,0,Vikramaditya Motwane,"Harshvardhan Kapoor, Priyanshu Painyuli, Dhritiman Chatterjee, Nishikant Kamat, Ashish Verma",2018
527665,tt8665648,Antony,01-06-2018,ta,0,5.1,11,0,Kuttii Kumar,"Nishanth Russo, Paul Michael, Cheran Raj, Lal",2018
527862,tt8065870,Officer,01-06-2018,te,4.3,3.1,463,0,Ram Gopal Varma,"Nagarjuna Akkineni, Myra Sareen, Ajay, Sayaji Shinde, Anwar Khan",2018
528765,tt7796428,Raju Gadu,01-06-2018,te,0,5.4,216,0,Sanjana Reddy,"Raj Tarun, Amyra Dastur, Pujita Ponnada, Rajendra Prasad, Sithara",2018
529164,tt1572776,Moz & Cat,12-04-2009,ml,2,2.8,279,0,Fazil,"Dileep, Aswathy Ashok, Harisree Ashokan, Anoop Chandran, Niveditha Vijayan",2009
529165,tt8665760,Vanilla,01-06-2018,kn,0,6.1,28,0,Jayathirtha,"Avinash J, Swathi Konde, Ravishanker Gowda, Pavana",2018
530071,tt7838158,Naa Nuvve,14-06-2018,te,5,4.5,221,0,Jayendra,"Tamannaah Bhatia, Kalyan Ram, Vennela Kishore, Posani Krishna Murali, Praveen",2018
530198,tt8043092,Sammohanam,15-06-2018,te,7,7.5,2268,0,Mohana Krishna Indraganti,"Sudheer Babu, Aditi Rao Hydari, Naresh, Pavitra Lokesh, Harshini Koduru",2018
530217,tt7748196,R. K. Nagar,17-12-2019,ta,3.3,5.4,175,0,Saravana Rajan,"Vaibhav, Sana Althaf, Sampath Raj, Anjena Kirti, T. Siva",2019
530276,tt7096060,Hombanna,07-07-2017,kn,8.5,8.2,72,0,Rakshith Thirthahalli,Unknown,2017
530581,tt4641602,365 Days,22-05-2015,te,4.762,2.2,291,0,Ram Gopal Varma,"Nandu Vijay Krishna, Anaika Soti, Krishnudu, Posani Krishna Murali, Surekha Vani",2015
530588,tt7345930,Abrahaminte Santhathikal,15-06-2018,ml,5.69,6.6,5867,0,Shaji Padoor,"Mammootty, Anson Paul, Yog Jappie, Siddique, Renji Panicker",2018
530750,tt1740676,Inkosari,26-02-2010,te,0,6.6,57,0,Suman Pathuri,"Raja, Richa Pallod, Manjari Fadnnis, Vennela Kishore, Rao Ramesh",2010
530759,tt1200068,Mee Sreyobhilashi,28-12-2007,te,7,7.3,149,0,V Eshwar Reddy,"Rajendra Prasad, Brahmanandam, Tanikella Bharani, Chalapathi Rao, Nassar",2007
530957,tt8042260,Kanne Kalaimaane,22-02-2019,ta,6.6,6.2,375,0,Seenu Ramasamy,"Udhayanidhi Stalin, Tamannaah Bhatia, Vadivukarasi, Vasundhara Kashyap, 'Poo' Ram",2019
531004,tt1579807,Masth,23-01-2009,te,0,2.8,28,0,S.V. Krishna Reddy,"Brahmanandam, Sivaji Sontineni, Siva Balaji, Sanjay Reddy",2009
531025,tt1579953,Gopi Goda Meeda Pilli,16-11-2006,te,5,4.9,58,0,Janardhan Maharshi,"Allari Naresh, Jagapati Babu, Gowri Munjal, Aarti Chabria, Brahmanandam",2006
531048,tt8885486,Memu Vayasuku Vacham,23-06-2012,te,7.5,7.5,32,0,Trinadha Rao Nakkina,"Tanish Alladi, Thagubothu Ramesh, Dhanraj Sukhram, Rama Prabha, Niti Taylor",2012
531059,tt5664854,Gurukulam – The School,27-10-2016,te,0,9.5,64,0,BVR Shiva kumar,"Ramakrishna Meka, Rajiv Kanakala",2016
531597,tt8202612,Satyameva Jayate,15-08-2018,hi,6.5,5.7,8355,0,Milap Zaveri,"John Abraham, Manoj Bajpayee, Aisha Sharma, Amruta Khanvilkar, Tota Roy Chowdhury",2018
531601,tt7881524,Arjun Patiala,19-07-2019,hi,4.1,4.4,1733,0,Rohit Jugraj,"Diljit Dosanjh, Kriti Sanon, Varun Sharma, Ronit Roy, Seema Pahwa",2019
531711,tt8163746,Lolans,23-03-2018,ml,0,3,10,0,Salim Baba,"Nishan K. P. Nanaiah, S.P. Sreekumar, Indrans, Sunil Sukhada, Abu Salim",2018
531723,tt7523010,Koode,14-07-2018,ml,7.2,7.6,3090,0,Anjali Menon,"Prithviraj Sukumaran, Nazriya Nazim, Parvathy Thiruvothu, Ranjith, Maala Parvathi",2018
531730,tt8269352,Neeli,11-08-2018,ml,6,4.8,241,0,Althaf Rahman,"Mamta Mohandas, Anoop Menon, Zinil Zainuddin, Baburaj, S.P. Sreekumar",2018
531897,tt8071688,Jamba Lakidi Pamba,22-06-2018,te,7,5.9,892,0,J.B. Murali Krishna,"Srinivasa Reddy, Siddhi Idnani, Vennela Kishore, Posani Krishna Murali, Tanikella Bharani",2018
532206,tt8459220,Kaitholachathan,25-05-2018,ml,0,6.8,12,0,Sumeesh Ramakrishnan,"Levin Simon Joseph, Kalabhavan Shajon, Vinod Kedamangalam, Mamukkoya, Jayan Cherthala",2018
532213,tt8517350,Dustbin,01-06-2018,ml,0,6.3,8,0,Madhu Thattampally,"Madhu, Sudheer Karamana, Kulappulli Leela",2018
532215,tt8512330,Marubhoomiyile Mazhathullikal,01-06-2018,ml,4,4,12,0,Anil Karakkulam,"Chembil Ashokan, Balachandran Chullikkadu, Devan, Gokulan, Shaju Sreedhar",2018
532219,tt8507348,Velakkariyayirunnalum Neeyen Mohavalli,15-06-2018,ml,0,7.6,9,0,Govind Varaha,"Rahul Madhav, Shravya, Rizabawa, Prasanth Alexander, Madhu",2018
532869,tt8094252,NGK,31-05-2019,ta,4.818,5.7,5778,0,Selvaraghavan,"Suriya, Rakul Preet Singh, Sai Pallavi, Ilavarasu, Bala Singh",2019
533237,tt7919680,Karwaan,03-08-2018,hi,7.071,7.6,20318,3489863,Akarsh Khurana,"Dulquer Salmaan, Mithila Palkar, Irrfan Khan, Kriti Kharbanda, Amala Akkineni",2018
533238,tt7986222,Kolamavu Kokila,17-08-2018,ta,6.643,7.3,4033,0,Nelson Dilipkumar,"Nayanthara, Yogi Babu, Saranya Ponvannan, Jacqueline, R.S. Shivaji",2018
533296,tt8665770,Kasu Mela Kasu,06-07-2018,ta,0,5.8,15,0,K. S. Palani,"Mayilsamy, Ganja Karuppu, Kovai Sarala, Nalini, Jangiri Madhumitha",2018
533674,tt8333790,Neeya 2,24-05-2019,ta,0,2.8,186,0,L. K. Suresh,"Jai Sampath, Catherine Tresa, Raai Laxmi, Varalaxmi Sarathkumar, Balasaravanan",2019
533885,tt8411144,Kaappaan,19-09-2019,ta,5.6,6.2,6916,0,K. V. Anand,"Suriya, Mohanlal, Arya, Sayesha Saigal, Samuthirakani",2019
533889,tt8042324,Lakshmi,24-08-2018,ta,7.8,6.5,877,0,A. L. Vijay,"Prabhu Deva, Ditya Bhande, Aishwarya Rajesh, Karunakaran, Kovai Sarala",2018
533901,tt7542962,Miga Miga Avasaram,08-11-2019,ta,7.3,7.2,190,0,Suresh Kamatchi,"Sri Priyanka, Arish Kumar, Muthu Raman, E. Ramadoss, Saravana Sakthi",2019
534006,tt8619956,Kidu,29-06-2018,ml,1.5,4.2,832,0,Majeed Abu,"Ramzan Muhammed, Anagha Stibin, Abdullah Ayman, Sudhi Koppa, Leona Lishoy",2018
534081,tt7094488,Sandeep Aur Pinky Faraar,19-03-2021,hi,6.6,6.3,9276,0,Dibakar Banerjee,"Parineeti Chopra, Arjun Kapoor, Jaideep Ahlawat, Neena Gupta, Raghubir Yadav",2021
534343,tt7963804,Pantham,05-07-2018,te,6.2,5.8,589,0,K. Chakravarthy Reddy,"Gopichand, Mehreen Pirzada, Sampath Raj, Mukesh Rishi, Jayaprakash Reddy",2018
534530,tt7765910,Aravinda Sametha Veera Raghava,11-10-2018,te,7.2,7.3,10580,0,Trivikram Srinivas,"N.T. Rama Rao Jr., Pooja Hegde, Jagapati Babu, Naveen Chandra, Eesha Rebba",2018
534773,tt8599324,Police Junior,22-06-2018,ml,0,7.2,16,0,Suresh Shankar,"Shanavas Shanu, Narain, Sunil Sukhada, Kanakalatha",2018
534985,tt2150177,Bhaiaji Superhitt,23-11-2018,hi,4,3.9,704,0,Neeraj Pathak,"Sunny Deol, Preity Zinta, Arshad Warsi, Ameesha Patel, Shreyas Talpade",2018
534993,tt8959820,Petta,10-01-2019,ta,7.222,7.2,14997,0,Karthik Subbaraj,"Rajinikanth, Nawazuddin Siddiqui, Vijay Sethupathi, Sananth, M. Sasikumar",2019
535020,tt1503180,Thottal Poo Malarum,03-08-2007,ta,4.8,6,88,0,P. Vasu,"Sakthi Vasu, Gowri Munjal, Rajkiran, Sukanya, Vadivelu",2007
535144,tt8108200,Sonchiriya,01-03-2019,hi,8.026,7.9,13548,0,Abhishek Chaubey,"Sushant Singh Rajput, Bhumi Pednekar, Ashutosh Rana, Ranvir Shorey, Manoj Bajpayee",2019
535172,tt9664732,Disco Raja,24-01-2020,te,6.5,6.1,1793,0,Vi Anand,"Ravi Teja, Bobby Simha, Sunil Varma, Payal Rajput, Tanya Hope",2020
535223,tt8011344,Asuraguru,13-03-2020,ta,3.3,3.3,397,0,Rajdeep,"Vikram Prabhu, Mahima Nambiar, Yogi Babu, Subbaraju, Nagineedu Vellanki",2020
535397,tt8453078,Vijetha,12-07-2018,te,6,6.7,382,0,Rakesh Shashi,"Kalyaan Dhev, Malavika Nair, Murali Sharma, Prudhviraj, Tanikella Bharani",2018
535657,tt8733898,U Turn,13-09-2018,ta,6.84,6.9,4704,0,Pawan Kumar,"Samantha Ruth Prabhu, Aadhi Pinisetty, Rahul Ravindran, Bhumika Chawla, Narain",2018
536013,tt8042132,Kaalidas,13-12-2019,ta,6,6.7,1499,0,Sri Senthil,"Bharath Srinivasan, Ann Sheetal, Aadhav Kannadasan, Suresh Chandra Menon, R. Velraj",2019
536026,tt8364446,Trunk,13-07-2018,kn,4.5,4.4,51,0,Rishika Sharma,"Nihal Rajput, Vaishali Deepak, Sundara Shree, Aruna Balaraj, Rajesh Bhat",2018
536239,tt5650272,Galaate,11-01-2013,kn,1.3,4.2,32,0,M.D. Shridhar,"Prajwal Devaraj, Kriti Kharbanda, Hardhika Shetty, Shashikumar, Tara",2013
536429,tt7856166,Shailaja Reddy Alludu,31-08-2018,te,4.5,5.1,1111,0,Maruthi Dasari,"Naga Chaitanya Akkineni, Anu Emmanuel, Ramya Krishnan, Vennela Kishore, Kalyani Natarajan",2018
536475,tt8043456,Aa Karaala Ratri,13-07-2018,kn,5.6,7.9,1185,0,Dayal Padmanabhan,"Karthik Jayaram, Anupama Gowda, Rangayana Raghu, Naveen Krishna, Veena Sundar",2018
536613,tt8042116,House Owner,27-06-2019,ta,6.2,7,6326,0,Lakshmi Ramakrishnan,"Kishore, Kishore DS, Lovelyn Chandrasekhar, Sriranjini, Lakshmi Ramakrishnan",2019
536771,tt8190748,W/O Ram,20-07-2018,te,7,6.1,318,0,Vijay Yelakanti,"Lakshmi Manchu, Srikanth, Priyadarshi Pullikonda, Aadarsh Balakrishna, Samrat Reddy",2018
536939,tt8071204,Lover,20-07-2018,te,7,5.3,187,0,Annish Krishna,"Raj Tarun, Riddhi Kumar, Rajiv Kanakala, Subbaraju, Sachin Khedekar",2018
537639,tt8885168,Abbayi Class Ammayi Mass,03-08-2013,te,0,5.1,20,0,Srinivas Koneti,"Varun Sandesh, Hariprriya, Ali Basha, Srinivasa Reddy, Vennela Kishore",2013
538126,tt8698956,Lupt,02-11-2018,hi,3.9,4.6,8330,0,Prabhuraj,"Javed Jaffrey, Vijay Raaz, Meenakshi Dixit, Rishina Kandhari, Niki Aneja Walia",2018
538394,tt8060624,Nawabzaade,27-07-2018,hi,5,4.2,1187,0,Jayesh Pradhan,"Dharmesh Yelande, Punit Pathak, Raghav Juyal, Isha Rikhi, Mukesh Tiwari",2018
538402,tt8396232,Bhayanakam,20-07-2018,ml,7.8,7,115,0,Jayaraj,"Renji Panicker, Asha Sarath, Sabita Jayaraj, Keshav Jayaraj, Molly Kannamaly",2018
539036,tt6078866,Soni,18-01-2019,hi,6.779,7.1,3159,0,Ivan Ayr,"Geetika Vidya, Saloni Batra, Vikas Shukla, Mohit Chauhan, Himanshu Kohli",2019
539470,tt6514010,Brij Mohan Amar Rahe!,13-12-2017,hi,5.382,6.5,3016,0,Nikhil Nagesh Bhat,"Arjun Mathur, Sheetal Thakur, Manav Vij, Nidhi Singh",2017
539733,tt1214948,Bhram: An Illusion,04-04-2008,hi,2,4.1,143,0,Pavan Kaul,"Dino Morea, Simone Singh, Milind Soman, Deepshika Nagpal, Chetan Hansraj",2008
539811,tt8963248,60 Vayadhu Maaniram,31-08-2018,ta,0,6.6,187,0,Radha Mohan,"Vikram Prabhu, Prakash Raj, Samuthirakani, Indhuja Ravichandran, Elango Kumaravel",2018
539877,tt7997932,Katheyondu Shuruvagide,03-08-2018,kn,7.3,7.1,1609,0,Senna Hegde,"Diganth Manchale, Pooja Devariya, Shreya Anchan, Ashwin Rao Pallaki, Raaghu Raamanakoppa",2018
540160,tt4932624,Enga Kattula Mazhai,03-08-2018,ta,1,4,14,0,Sribalaji,"Sonu Gowda, Appukutty, Java Sundaresan, Aruldoss, Mithun Maheshwaran",2018
540180,tt8674158,Brand Babu,03-08-2018,te,4.5,5.3,258,0,P. Prabhakar,"Sumanth Shailendra, Eesha Rebba, Murali Sharma, Nalini, Pujita Ponnada",2018
540215,tt8688912,Chi La Sow,03-08-2018,te,7.6,7.7,2618,0,Rahul Ravindran,"Sushanth, Ruhani Sharma, Vennela Kishore, Anu Hasan, Rahul Ramakrishna",2018
540263,tt8108104,Happy Wedding,28-07-2018,te,8,4.5,154,0,Lakshman Karya,"Sumanth Ashwin, Niharika Konidela, Murali Sharma, Naresh, Pavitra Lokesh",2018
540396,tt8066574,Srinivasa Kalyanam,09-08-2018,te,5.3,6.1,1680,0,Satish Vegesna,"Nithiin, Raashii Khanna, Nandita Swetha, Prakash Raj, Jayasudha",2018
540399,tt8665806,Cuban Colony,06-07-2018,ml,8,5.5,59,0,Manoj Varghese Parecattil,"Aishwarya Unni, Jino John, Able Benni, Sreekanth Dasan, Seeraj Vikram",2018
540612,tt7162758,Paltan,07-09-2018,hi,6.2,5.2,1316,0,J. P. Dutta,"Arjun Rampal, Jackie Shroff, Sonu Sood, Sonal Chauhan, Esha Gupta",2018
541267,tt8590992,Paper Boy,31-08-2018,te,5.8,6.4,473,0,V. JayaShankarr,"Santosh Shoban, Riya Suman, Tanya Hope, Annapoorna, Abhishek Maharshi",2018
541487,tt8333978,Maharshi,09-05-2019,te,7,7.1,11167,31562422,Vamshi Paidipally,"Mahesh Babu, Pooja Hegde, Allari Naresh, Jagapati Babu, Prakash Raj",2019
541791,tt8907890,Velvet Nagaram,06-03-2020,ta,5,4.9,172,0,Manoj Kumar Natarajan,"Varalaxmi Sarathkumar, Ramesh Thilak, Arjai, Maalavika Sundar, Kasturi Shankar",2020
542092,tt8016648,Ente Mezhuthiri Athazhangal,27-07-2018,ml,6.5,7,816,0,Sooraj Tom,"Anoop Menon, Miya George, Hannah Reji Koshy, Dileesh Pothan, Lal Jose",2018
542104,tt8090628,Kinavalli,27-07-2018,ml,6,5.9,960,0,Sugeeth,"Ajmal Zayn, Surabhi Santosh, Vijay Johny, Krrish S. Kumar, Sujith Raj",2018
542460,tt8396128,Pataakha,28-09-2018,hi,6.9,7.2,4872,0,Vishal Bhardwaj,"Sanya Malhotra, Radhikka Madan, Sunil Grover, Vijay Raaz, Namit Das",2018
542794,tt8731842,Odu Raja Odu,17-08-2018,ta,6.5,5.4,111,0,Nishanth Ravindaran,"Guru Somasundaram, Nassar, Anand Sami, Lakshmi Priyaa, Ashiqa Salvan",2018
543398,tt7760084,Padayottam,14-09-2018,ml,5.9,6.3,595,0,Rafeek Ibrahim,"Biju Menon, Dileesh Pothan, Saiju Kurup, Sudhi Koppa, Ganapathi S. Poduval",2018
543415,tt8617992,Onthara Bannagalu,17-08-2018,kn,0,6.7,49,0,Sunil Bhimrao,"Kiran Srinivas, Hitha Chandrashekar, Sonu Gowda, Praveen Pugalia, Lohithaswa",2018
543530,tt11772702,Meendum Oru Mariyathai,21-02-2020,ta,0,4.4,28,0,Bharathiraja,"Bharathiraja, Rasi Nakshatra, Mounika, Joe Malloori",2020
543648,tt9318514,Reason,10-09-2018,hi,8.5,8.8,237,0,Anand Patwardhan,Unknown,2018
543692,tt7607940,Namaste England,19-10-2018,hi,5.4,2.1,3083,0,Vipul Amrutlal Shah,"Parineeti Chopra, Arjun Kapoor, Aditya Seal, Anil Charanjeett, Satish Kaushik",2018
544042,tt4479178,A New Love Ishtory,01-01-2013,hi,6,6.4,100,0,Unknown,Unknown,2013
544286,tt1961330,Good Luck!,08-08-2008,hi,0,3,25,0,Aditya Datt,"Aryeman Ramsay, Sayali Bhagat, Sharat Saxena, Archana Puran Singh, Mushtaq Khan",2008
544395,tt8894160,Ee Varsham Sakshiga,12-12-2014,te,0,5.8,20,0,Ramana Mogili,"Varun Sandesh, Hariprriya, Chalapathi Rao, Nalla Venu",2014
544679,tt8333792,Aaruthra,31-08-2018,ta,1,5.5,79,0,Pa. Vijay,"Pa. Vijay, K. Bhagyaraj, S. A. Chandrasekhar, Y. G. Mahendran, Mayilsamy",2018
544681,tt8484586,Neevevaro,24-08-2018,te,6.6,6.8,1050,0,Hari Nath,"Aadhi Pinisetty, Taapsee Pannu, Ritika Singh, Vennela Kishore, Saptagiri",2018
544758,tt8396272,Aatagallu,24-08-2018,te,4.8,5.1,198,0,R. K. Reddy,"Nara Rohith, Jagapati Babu, Darshana Banik, Brahmanandam, Mamilla Shailaja Priya",2018
544795,tt7391996,C/o Kancharapalem,07-09-2018,te,7.25,8.8,10741,0,Venkatesh Maha,"Kancharapalem Raju, Radha Bessy, Kesava Karri, Nitya Sri, Karthik Rathnam",2018
544891,tt8602654,Sarkari. Hi. Pra. Shale Kasaragodu,23-08-2018,kn,7.7,8.7,3355,4936739,Rishab Shetty,"Anant Nag, Pramod Shetty, Ramesh Bhat, Prakash Thuminad, Rishab Shetty",2018
545071,tt7559180,99 Songs,16-04-2021,hi,5.2,6.5,2413,0,Vishwesh Krishnamoorthy,"Ehan Bhat, Edilsy Vargas, Manisha Koirala, Lisa Ray, Tenzing Dalha",2021
545238,tt10731866,Bakrid,23-08-2019,ta,7,7.2,322,0,Jagadeesan Subu,"Vikranth, Vasundhara Kashyap, Ali Basha, Vaiyapuri, Rohit Pathak",2019
545273,tt8427036,Helicopter Eela,12-10-2018,hi,6.1,5.5,1370,0,Pradeep Sarkar,"Kajol, Riddhi Sen, Tota Roy Chowdhury, Neha Dhupia, Mukesh Rishi",2018
545576,tt8857610,Namdev Bhau in Search of Silence,11-10-2018,hi,6.5,7.2,129,0,Dar Gai,"Zoya Hussain, Namdev Gurav, Arya Dave",2018
545620,tt7722258,Genius,24-08-2018,hi,5.567,5.1,3829,0,Anil Sharma,"Nawazuddin Siddiqui, Mithun Chakraborty, Ayesha Jhulka, Ishita Chauhan, K.K. Raina",2018
546186,tt2398173,Happy Happy Ga,20-08-2010,te,7.5,4.6,32,0,Priya Sharan,"Varun Sandesh, Saranya Mohan, Ali Basha, Vega Tamotia",2010
546241,tt4232066,Once Again,24-04-2019,hi,6.2,6.9,1311,0,Kanwal Sethi,"Neeraj Kabi, Shefali Shah, Priyanshu Painyuli, Rasika Dugal, Bidita Bag",2019
546380,tt7754540,Odavum Mudiyadhu Oliyavum Mudiyadhu,15-12-2023,ta,7,3.3,2372,0,Ramesh Venkat,"Sathyamurthi .V, Gopi Aravindh, Sudhakar Jayaraman, Yashika Anand, Riythvika",2023
546573,tt6615648,Manu,07-09-2018,te,6.5,7.6,1181,0,Phanindra Narsetti,"Raja Goutham, Chandini Chowdary, Aberaam Varma, Mohan Bhagath, Bomma Sridhar",2018
546698,tt5991672,Yuddam,14-03-2014,te,0,3.8,45,0,Bharathi Ganesh,"Yami Gautam Dhar, Srihari, Tarun",2014
547026,tt7526836,FryDay,12-10-2018,hi,6.5,5.3,989,0,Abhishek Dogra,"Govinda, Sanjay Mishra, Varun Sharma, Rajesh Sharma, Brijendra Kala",2018
547650,tt8136908,Halkaa,07-09-2018,hi,5.6,7.1,1024,0,Nila Madhab Panda,"Paoli Dam, Vipin Katyal, Ranvir Shorey, Tathastu, Kumud Mishra",2018
547715,tt8396216,Thodraa,07-09-2018,ta,0,4.7,9,0,Mathuraj,"Akshayaa Premnath, Jaichandra Saravanak, Prithvi Pandiarajan, Veena Nandakumar",2018
547723,tt5020726,Silvat,07-09-2018,hi,5.5,7,264,0,Tanuja Chandra,"Kartik Aaryan, Amal Farooque, Maaman Memon, Meher Mistry",2018
547768,tt8852558,Mitron,14-09-2018,hi,6.4,6.9,2829,0,Nitin Kakkar,"Jacky Bhagnani, Kritika Kamra, Prateik Smita Patil, Perlene Bhesania, Rishi Panchal",2018
547944,tt5652478,The Great Story of Sodabuddi,15-04-2016,te,1,7.5,32,0,Jyothirao Mohith,"Uthpal, Anusha, Khushi, Rangayana Raghu, Achyuth Kumar",2016
548057,tt8364128,Amma I Love You,13-05-2018,kn,1,6.9,141,0,K. M. Chaitanya,"Chiranjeevi Sarja, Nishvika Naidu, Sithara, Chikkanna, Prakash Belawadi",2018
548082,tt7297002,Luv Shuv Pyar Vyar,03-03-2017,hi,0,4.6,38,0,Pardeep Raja,"Gaurav Ajay Kaura, Dolly Chawla, Pankaj Bali, Promita Banik, Lokesh Bhatta",2017
548382,tt8535472,Silly Fellows,07-09-2018,te,4,5.7,280,0,Bhimaneni Srinivasa Rao,"Allari Naresh, Sunil Varma, Brahmanandam, Chitra Shukla, Nandini Rai",2018
548402,tt3893476,Spark,10-10-2014,hi,0,5.7,53,0,Unknown,"Rajneesh Duggal, Subhashree Ganguly, Rati Agnihotri, Mansha Bahl, Manoj Joshi",2014
548788,tt8688202,Ennaalum Sarath..?,27-07-2018,ml,0,4.7,15,0,Balachandra Menon,"Charlie Joe, Balachandra Menon, Parvathy Arun, Nithya Naresh, Surabhi Lakshmi",2018
548849,tt8365050,Raambo 2,16-05-2018,kn,5.3,5.6,134,0,Unknown,"Sharan, Ashika Ranganath, Chikkanna, Tabla Nani, Kuri Prathap",2018
548850,tt7030172,Bhanta,13-09-2008,kn,8,8,9,0,Vishal Shekar,"Adi Lokesh, Rupa Sri, Pavan Kumar N R",2008
548945,tt6689882,Rangeela Raja,18-01-2019,hi,0,2,306,0,Sikander Bharti,"Govinda, Shakti Kapoor, Digangana Suryavanshi, Mishika Chourasia, Govind Namdeo",2019
549267,tt7738134,The Unknown Craftsman,10-09-2017,hi,0,7.1,32,0,Amit Dutta,"Sunil Rana, Nitin Goel, Rahat Mahajan, Dolly Rana, Mr. Amit Singh",2017
549521,tt8408216,Mangalyam Thanthunanena,20-09-2018,ml,6,4.8,247,0,Soumya Sadanandan,"Kunchacko Boban, Nimisha Sajayan, Hareesh Perumanna, Soubin Shahir, Salim Kumar",2018
549524,tt6726070,Raja Ranguski,21-09-2018,ta,5.313,6.4,360,0,Dharani Dharan,"Metro Shirish, Chandhini Tamilarasan, Kalloori Vinoth, Jayakumar, Anupama Kumar",2018
549541,tt8737640,Nartanasala,29-08-2018,te,5.7,4.1,332,0,Srinivas Chakravarthi,"Yamini Bhaskar, Jayaprakash Reddy, Naga Shaurya, V. S. Roopa Lakshmi, Kashmira Pardesi",2018
549733,tt8650270,Nannu Dochukunduvate,20-09-2018,te,6.2,6.7,699,50,R. S. Naidu,"Sudheer Babu, Nabha Natesh, Nassar, Harsha Chemudu, Venu",2018
