tmdb_id,imdb_id,title,release_date,language,rating_tmdb,rating_imdb,votes_imdb,revenue,director,cast,release_year
890986,tt15523028,Bekhudi,29-10-2021,hi,7.5,4.3,752,0,Amit Kasaria,"Adhyayan Suman, Anurag Sharma, Dev Sharma, Gulki Joshi, Divya Seth Shah",2021
891268,tt15289238,Yennanga Sir Unga Sattam,29-10-2021,ta,7,7.3,873,0,Prabhu Jeyaram,"R. S. Karthik, Ayraa, Soundarya Bala Nandakumar, Rohini, Sai Dhanyaa",2021
891479,tt14994064,Adbhutham,19-11-2021,te,7.3,7.5,1883,0,Mallik Ram,"Teja Sajja, Shivani Rajashekar, Satya, Tulasi, Mirchi Kiran",2021
892121,tt13782132,03:33,10-12-2021,ta,5.3,4.9,237,0,Nambikkai Chandru,"Sandy, Gautham Vasudev Menon, Shruthi Selvam, Mime Gopi, Reshma Pasupuleti",2021
892269,tt15816190,Ravanasura,07-04-2023,te,4.867,5.7,2770,0,Sudheer Varma,"Ravi Teja, Anu Emmanuel, Megha Akash, Sushanth, Faria Abdullah",2023
892694,tt2592122,Feather,16-03-2013,te,0,7.8,23,0,Raam Reddy,Unknown,2013
893055,tt15826290,Enthada Saji,08-04-2023,ml,3.2,3.9,536,0,Godfy Babu,"Kunchacko Boban, Jayasurya, Nivetha Thomas, Sidhartha Siva, Prem Prakash",2023
893170,tt10245574,Daddy's Got Moves,08-05-2019,hi,0,8.7,39,0,Shiladitya Bora,Manu Rishi Chadha,2019
893174,tt11086286,Vikalp,04-11-2021,hi,0,6.7,19,0,Dheeraj Jindal,"Neha Sharma, Anshul Chauhan",2021
893487,tt15416668,Guduputani,17-09-2021,te,0,6.4,1878,0,K. M. Kumar,"Saptagiri, Neha Solanki, Raghu Kunche, Ananth Babu, Raghu Karumanchi",2021
893591,tt15816336,Nadikar,03-05-2024,ml,2,5.1,2849,0,Lal Jr.,"Tovino Thomas, Soubin Shahir, Bhavana, Balu Varghese, Suresh Krishna",2024
893614,tt15831978,Cash,19-11-2021,hi,7,6.5,4567,0,Rishab Seth,"Amol Parashar, Smriti Kalra, Kavin Dave, Swanand Kirkire, Gulshan Grover",2021
893653,tt9688874,Tiger Nageswara Rao,20-10-2023,te,5.821,6,4792,0,Vamsee Krishna,"Ravi Teja, Anupam Kher, Gayatri Bhardwaj, Nupur Sanon, Renu Desai",2023
893698,tt15686202,No Man's Land,19-11-2021,ml,6.5,5.5,868,0,Jishnu Harindra Varma,"Lukman Avaran, Sudhi Koppa, Sreeja Das, Anu Krishna, Shafeek Karim",2021
893955,tt15839278,Vanam,26-11-2021,ta,8,6,993,0,Srikantan Anand,"Vetri, Smruthi Venkat, Anu Sithara, Vela Ramamoorthy, N. Azhagamperumal",2021
894074,tt15056872,Poikkal Kuthirai,05-08-2022,ta,6,6.2,288,0,Santhosh P. Jayakumar,"Prabhu Deva, Raiza Wilson, Varalaxmi Sarathkumar, Prakash Raj, Baby Aazhiya",2022
894464,tt13106182,Marutha,21-01-2022,ta,8,5.2,48,0,GRS,"Ganja Karuppu, Lovelyn Chandrasekhar, Radikaa Sarathkumar, Viji Chandrasekhar, G. Marimuthu",2022
894749,tt16393520,Jayamma Panchayathi,06-05-2022,te,7,6.2,356,0,Vijay Kumar Kalivarapu,"Suma Kanakala, Devi Prasad, Shalini Kondepudi, Dinesh Kumar",2022
894762,tt13664684,Karthikeya 2,13-08-2022,te,6.25,7.8,65147,10384945,Chandoo Mondeti,"Nikhil Siddhartha, Anupama Parameswaran, Srinivasa Reddy, Harsha Chemudu, Adithya Menon",2022
894803,tt20850406,Sita Ramam,05-08-2022,te,7.8,8.5,83062,11800000,Hanu Raghavapudi,"Dulquer Salmaan, Mrunal Thakur, Rashmika Mandanna, Sumanth, Gautham Vasudev Menon",2022
895020,tt6409236,Srikanta,06-01-2017,kn,0,6.3,72,0,Unknown,"Shiva Rajkumar, Chandini Sreedharan",2017
895033,tt10709484,Don,12-05-2022,ta,6,6.8,12853,0,Cibi Chakaravarthi,"Sivakarthikeyan, Priyanka Arul Mohan, S. J. Suryah, Samuthirakani, Soori",2022
895077,tt13885642,Sabhaapathy,19-11-2021,ta,5.4,5.7,2716,0,R. Srinivasa Rao,"Santhanam, Preeti Verma, M. S. Bhaskar, Sayaji Shinde, Pugazh",2021
895126,tt10825064,Herova? Zerova?,11-09-2008,ta,0,9.4,170,0,V. Priya,M. Karunanidhi,2008
895309,tt13080724,Vellari Pattanam,24-03-2023,ml,3,3.6,343,0,Mahesh Vettiyaar,"Manju Warrier, Soubin Shahir, Krishna Shankar, Salim Kumar, Suresh Krishna",2023
896053,tt15847722,Mission-C,05-11-2021,ml,4.5,3.5,351,0,Vinod Guruvayoor,"Sarath Kumar, Meenakshi Dinesh, Major Ravi, Kailash, Jayakrishnan",2021
896166,tt15816392,Monster,21-10-2022,ml,3.25,4.4,3325,0,Vysakh,"Mohanlal, Sudev Nair, Honey Rose, Lakshmi Manchu, Siddique",2022
896440,tt15943910,Keedam,20-05-2022,ml,6.167,6.3,746,0,Rahul Riji Nair,"Rajisha Vijayan, Sreenivasan, Vijay Babu, Manikandan Pattambi, Renjit Shekar",2022
896449,tt22486094,Ori Devuda..!,21-10-2022,te,6.857,7.1,1432,0,Ashwath Marimuthu,"Vishwak Sen, Mithila Palkar, Venkatesh, Asha Bhat, Rahul Ramakrishna",2022
896669,tt15387190,Veera Simha Reddy,12-01-2023,te,4.7,4.8,6704,0,Gopichand Malineni,"Nandamuri Balakrishna, Varalaxmi Sarathkumar, Duniya Vijay, Honey Rose, Lal",2023
896828,tt16077654,Padmini,07-07-2023,ml,6.7,6.4,1589,0,Senna Hegde,"Kunchacko Boban, Aparna Balamurali, Madonna Sebastian, Vincy Aloshious, Ganapathi S. Poduval",2023
897371,tt15793046,Ippudu Kaaka Inkeppudu,06-08-2021,te,0,5.8,262,0,Y. Yugandhar,"Hasavanth Vanga, Nuveksha, Tanikella Bharani, Tulasi, Raja Ravindra",2021
897515,tt15516226,Chhatriwali,20-01-2023,hi,6,6.6,11277,0,Tejas Vijay Deoskar,"Rakul Preet Singh, Sumeet Vyas, Satish Kaushik, Prachee Shah, Rajesh Tailang",2023
897732,tt3526430,After The Third Bell,04-04-2014,hi,0,6.6,50,0,Unknown,Unknown,2014
897842,tt15840188,Chalo Premiddam,19-11-2021,te,0,7.5,1573,0,Suresh Seker Repale,"Sai Ronak, Neha Solanki, Shashank, Nagineedu Vellanki, Ali Basha",2021
898842,tt15767726,Ram Asur,19-11-2021,te,9,3.9,2861,0,Triparna Venkatesh,"Abhinav Sardar, Ram Karthik, Chandhini Tamilarasan, Sherry Agarwal, Suman Talwar",2021
898858,tt14868676,Ravana Lanka,19-11-2021,te,0,3.1,1226,0,B. N. S. Raju,"Krish Bandipalli, Ashmita Kaur Bakshi, Murali Sharma, Dev Gill, Sheethal Bhat",2021
898920,tt15458036,Savitri W/O Satyamurthy,19-11-2021,te,0,6.8,1336,0,Chaithanya Konda,"Parvateesam, Srilakshmi, Suman Shetty, Ananth Babu, Gautam Raju",2021
898976,tt15709840,Kolai,21-07-2023,ta,5.273,5.3,826,0,Balaji K. Kumar,"Vijay Antony, Ritika Singh, Meenakshi Chaudhary, Radikaa Sarathkumar, Murali Sharma",2023
899187,tt16058966,Border,12-11-2021,ta,0,5.8,12,0,Venkatesh S,"Charles Anthony Samy, Boxer Dheena, Billy Murali, Avinash, Kavita Radheshyam",2021
899410,tt13919696,Meppadiyan,14-01-2022,ml,7.2,7.1,4485,0,Vishnu Mohan,"Unni Mukundan, Kottayam Ramesh, Saiju Kurup, Anju Kurian, Aju Varghese",2022
899425,tt15768294,Banaras,04-11-2022,kn,4,6.2,3261,0,Jayathirtha,"Sonal Monteiro, Zaid Khan, Sujay Shastri, Devaraj, Achyuth Kumar",2022
899661,tt16078152,Iravatham,06-05-2022,te,7,6.3,2210,0,Suhaas Meera,"Tanvi Negi, Raja Ravindra, Ester Noronha, Jaya Vahini, Saptagiri",2022
899705,tt16148654,Captain,08-09-2022,ta,4.8,4.4,1316,0,Shakti Soundar Rajan,"Arya, Aishwarya Lekshmi, Simran, Gokulnath, Kavya Shetty",2022
899718,tt16139258,Yodha,15-03-2024,hi,6.6,5.8,9274,0,Sagar Ambre,"Sidharth Malhotra, Raashii Khanna, Disha Patani, Sunny Hinduja, Tanuj Virwani",2024
899746,tt13144110,Visithiran,06-05-2022,ta,7.5,6.5,270,0,Padmakumar M,"R. K. Suresh, Poorna, Madhu Shalini, Bagavathi Perumal, G. Marimuthu",2022
900169,tt15387224,Shivaji Surathkal 2: Mysterious case of Maayavi,14-04-2023,kn,1,6.7,613,0,Akash Srivatsa,"Ramesh Aravind, Radhika Narayan, Meghana Gaonkar, Raaghu Raamanakoppa, Vidya Murthy",2023
901225,tt15163876,Veerapandiyapuram,17-02-2022,ta,7,5.3,139,0,Suseenthiran,"Jai Sampath, Meenakshi Govindarajan, Aakanksha Singh, Kaali Venkat, Jayaprakash",2022
901254,tt16211502,Chithirai Sevvaanam,03-12-2021,ta,6,6.6,281,0,Stunt Silva,"Samuthirakani, Pooja Kannan, Rima Kallingal, Vidhya Pradeep, Nizhalgal Ravi",2021
901315,tt16227342,Mr. & Mrs. Mahi,31-05-2024,hi,5.9,5.9,16260,0,Sharan Sharma,"Rajkummar Rao, Janhvi Kapoor, Kumud Mishra, Rajesh Sharma, Zarina Wahab",2024
901489,tt16211122,Ayothi,03-03-2023,ta,6.5,8.2,4119,0,R. Manthira Moorthy,"M. Sasikumar, Preethi Asrani, Yashpal Sharma, Anju Asrani, Pugazh",2023
901521,tt16077646,Methagu-II,19-08-2022,ta,7,6.6,316,0,Raako.Yoagandran,"Kutti Mani, Eeshwar Baasha, Aanandan",2022
901562,tt16169406,Andaman,20-11-2021,hi,0,8.5,387,0,Smita Singh,"Sanjay Mishra, Rajesh Tailang, Anand Raaj",2021
903142,tt15654654,Thaggedhe Le,04-11-2022,te,7,5.1,120,0,Srinivasa Raju,"Naveen Chandra, Divya Pillai, Ananya Raj, Naina Ganguly, Makrand Deshpande",2022
903283,tt18885164,Sebastian P.C. 524,04-03-2022,te,4.5,4.2,202,0,Balaji Sayyapureddy,"Kiran Abbavaram, Nuveksha, Komalee Prasad, Rohini, Srikanth Iyengar",2022
903290,tt12099850,Ole Kanda Naal,19-03-2021,ml,0,7.3,39,0,Musthafa Gutz,"Deljo Dominic, Shivaji Guruvayoor, Neena Kurup, Jothish Jo",2021
903548,tt15547998,Patterns of life: Prana,01-10-2021,ml,0,7.7,13,0,Vipin A. Davis,Nassar,2021
904699,tt2040294,Blood Honour Bleeds,21-08-2011,hi,0,8.8,11,0,Samik Roy Choudhury,Unknown,2011
904704,tt13130428,Andhagan,09-08-2024,ta,7,6.6,1264,0,Thyagarajan,"Prashanth, Simran, Priya Anand, Karthik Muthuraman, Samuthirakani",2024
904718,tt12953750,Nenjuku Needhi,20-05-2022,ta,7.333,7.1,1689,0,Arunraja Kamaraj,"Udhayanidhi Stalin, Tanya Ravichandran, Aari Arjuna, Shivani Rajashekar, Yamini Chander",2022
904740,tt15057094,Drishya 2,10-12-2021,kn,0,7.5,213,0,P. Vasu,"V. Ravichandran, Anant Nag, Asha Sarath, Prabhu, Navya Nair",2021
910837,tt15415872,Selfie,01-04-2022,ta,8,6,604,0,Mathimaran Pugazhendhi,"G. V. Prakash Kumar, Varsha Bollamma, Gautham Vasudev Menon, DG. Gunanidhi, Vagai Chandrasekar",2022
911154,tt6265050,Shabaash Mithu,15-07-2022,hi,6.1,5.6,8486,0,Srijit Mukherji,"Taapsee Pannu, Vijay Raaz, Mumtaz Sorcar, Inayat Verma, Brijendra Kala",2022
911289,tt13004806,A Ranjith Cinema,08-12-2023,ml,5.2,4.9,2704,0,Nishanth Sattu,"Asif Ali, Namitha Pramod, Saiju Kurup, Anson Paul, Balachandra Menon",2023
911560,tt13553396,Parallel Lines,03-12-2021,ta,0,6.4,250,0,Kiran R,"Vatsan M Natarajan, Masanth Natarajan, Nagarajan Kannan, Pranav Kiruthik, V. S. Gurunath",2021
911645,tt10733228,Gehraiyaan,11-02-2022,hi,5.514,5.6,45134,0,Shakun Batra,"Deepika Padukone, Siddhant Chaturvedi, Ananya Panday, Dhairya Karwa, Naseeruddin Shah",2022
912381,tt23848626,Khedda,02-12-2022,ml,0,5.9,864,0,Manoj Kana,"Asha Sarath, Uthara Sarath, Sudheer Karamana, Sarayu Mohan, Jolly Chirayath",2022
913046,tt13761284,Shaakuntalam,14-04-2023,te,4.2,4.3,1915,0,Gunasekhar,"Samantha Ruth Prabhu, Dev Mohan, Aditi Balan, Ananya Nagalla, Sachin Khedekar",2023
914032,tt15661818,Oomai Sennai,10-12-2021,ta,9,5.3,1308,0,Arjunan Ekalaivan,"Michael Thangadurai, Sanam Shetty, Gajaraj, Jayakumar, Arul D. Shankar",2021
914416,tt11866940,Oruthee,18-03-2022,ml,6.2,7.3,1488,0,V. K. Prakash,"Navya Nair, Vinayakan, Saiju Kurup, Geethi Sangeetha, Shiny Sarah",2022
914605,tt16420402,Blood Money,24-12-2021,ta,5.5,6.4,415,0,K. M. Sarjun,"Priya Bhavani Shankar, Metro Shirish, Kishore, Subbu Panchu, Supergood Subramani",2021
914880,tt15710168,Senapathi,31-12-2021,te,8.5,7.4,488,0,Pavan Sadineni,"Rajendra Prasad, Naresh Agastya, Gnaneswari Kandregula, Pavani Reddy, Harsha Vardhan",2021
915501,tt15341044,Laththi Charge,22-12-2022,ta,6.8,6.4,2994,0,A. Vinoth Kumar,"Vishal Krishna, Sunaina, Prabhu, Misha Ghoshal, Munishkanth",2022
915776,tt15614274,Double XL,04-11-2022,hi,5.45,4.6,4640,0,Satramm Ramani,"Sonakshi Sinha, Huma Qureshi, Zaheer Iqbal, Mahat Raghavendra, Jimmy Shergill",2022
915932,tt14748152,Meendum,31-12-2021,ta,9,6.3,1224,0,Saravana Subbiah,"Kathiravan, Saravana Subbiah, Anagha, Pranav Raayan, Yaar Kannan",2021
916363,tt6143092,Code Name Abdul,10-12-2021,hi,0,4.9,632,0,Unknown,Tanishaa Mukerji,2021
916472,tt21653890,Trigger,23-09-2022,ta,4.8,5.9,556,0,Sam Anton,"Atharvaa Murali, Tanya Ravichandran, C. Arun Pandian, Seetha, Krishnakumar Ramakumar",2022
916958,tt15478268,Love You Rachchu,31-12-2021,kn,6,6.3,108,0,Shankar S Raj,"Rachita Ram, Ajai Rao, Achyuth Kumar, Raghu Shivamogga, B Suresha",2021
916963,tt15483616,Harikathe Alla Girikathe,23-06-2022,kn,5,6.6,403,0,Karan Ananth,"Rishab Shetty, Rachana Inder, Pramod Shetty, Honnavalli Krishna, Thapaswini",2022
918004,tt13470278,Sehari,11-02-2022,te,7,6.7,1331,0,Gnanasagar Dwaraka,"Harsh Kanumilli, Simran Choudhary, Abhinav Gomatam, Anisha Alla, Saluri Koteswara Rao",2022
918742,tt15581368,Rohingya - People from nowhere,01-12-2021,hi,7,5.4,56,0,Haider Khan,"Tangia Zaman Methila, Baharul Islam, Anil Choudhary, Audrey Hathi Barua",2021
919031,tt15891396,Tiku Weds Sheru,22-06-2023,hi,6.2,3.4,3547,0,Sai Kabir,"Nawazuddin Siddiqui, Avneet Kaur, Akshat Jain, Khushi Bhardwaj",2023
919040,tt4944504,Chaska: An Addiction,01-01-2006,hi,0,3.6,9,0,Hriday Sharma,"Haider, Nitu, Preeti, Jhony Nirmal, Ramesh Goyal",2006
919229,tt11148028,Theerpugal Virkkapadum,31-12-2021,ta,0,6.6,269,0,Dheeran Arunkumar,"Sathyaraj, Smruthi Venkat, Harish Uthaman, George Mariyan, Madhusudhan Rao",2021
919313,tt23333760,Naan Mirugamaai Maara,18-11-2022,ta,0,4.3,105,0,Sathyasiva,"M. Sasikumar, Hariprriya, Vikranth, Madhusudhan Rao, Sarath Kumar",2022
920026,tt13859494,Guthlee Ladoo,09-07-2022,hi,6.5,7.6,1663,0,Ishrat R Khan,"Sanjay Mishra, Dhanay Seth, Heet Sharma, Subrat Dutta, Kalyanee Mulay",2022
920089,tt12015076,Aviyal,07-04-2022,ml,6,4.7,702,0,Shanil Muhammed,"Joju George, Anaswara Rajan, Ketaki Narayan Kulkarni, Athmeeya Rajan, Sirajudheen Nazar",2022
920679,tt15576460,Zara Hatke Zara Bachke,02-06-2023,hi,5.7,5.9,16904,0,Laxman Utekar,"Vicky Kaushal, Sara Ali Khan, Rakesh Bedi, Sushmita Mukherjee, Neeraj Sood",2023
920736,tt21149558,Happy Birthday,08-07-2022,te,5.833,5.6,616,3294,Ritesh Rana,"Lavanya Tripathi, Satya, Vennela Kishore, Naresh Agastya, Gundu Sudarshan",2022
920758,tt14461690,Enna Solla Pogirai,13-01-2022,ta,8,4.7,2923,0,A. Hariharan,"Ashwin Kumar, Teju Ashwini, Avantika Mishra, Delhi Ganesh, Subbu Panchu",2022
921135,tt15509688,Ennalum Ente Aliya,06-01-2023,ml,5.6,5.5,1079,0,Bash Mohammed,"Suraj Venjaramoodu, Lenaa, Siddique, Gayatri Arun, Meera Nandan",2023
921177,tt16730140,Sithai,14-04-2021,ta,0,8.9,25,0,Karthi ram,"Biju, Anu, Ravi",2021
921382,tt13458764,Kinnerasani,10-06-2022,te,7.5,6.1,110,0,Ramana Teja,"Kalyaan Dhev, Ravindra Vijay, Ann Sheetal, Kashish Khan, Mahati Bikshu",2022
921403,tt16750728,Murder At Teesri Manzil 302,31-12-2021,hi,0,4.1,256,0,Navneet Baj Saini,"Irrfan Khan, Ranvir Shorey, Deepal Shaw, Lucky Ali, Nausheen Sardar Ali",2021
921682,tt16478968,Velan,31-12-2021,ta,7.5,4,356,0,Kavin,"Mugen Rao, Meenakshi Govindarajan, Prabhu, Soori, Prankster Rahul",2021
921759,tt16436466,Kannadiga,17-12-2021,kn,0,7.7,87,0,Unknown,Unknown,2021
922007,tt10415562,Raavana Kottam,12-05-2023,ta,0,4.3,208,0,Vikram Sugumaran,"Shanthanu Bhagyaraj, Anandhi, Prabhu, Sanjay Saravanan, Ilavarasu",2023
922087,tt23052532,Mark Antony,15-09-2023,ta,6.033,6.6,6440,0,Adhik Ravichandran,"Vishal Krishna, S. J. Suryah, Sunil Varma, Selvaraghavan, Ritu Varma",2023
922104,tt3527144,The Dirty Relation,14-06-2013,hi,0,4,24,0,Kesar Matharu,"Sanjay Chauhan, Jasleen Matharu, Kanwaljeet Matharu, Kesar Matharu, Sonia Mishra",2013
922128,tt15094962,RJ Madonna,25-12-2021,ml,5,6.5,90,0,Anand Krishna Raj,"Amalendu K Raj, Anil Anto, Shersha Sherief, Jijo Jacob, Nileen Sandra",2021
922360,tt23646278,Nirangal Moondru,22-11-2024,ta,5.7,6.1,677,0,Karthick Naren,"Atharvaa Murali, R. Sarathkumar, Rahman, Ammu Abhirami, Dushyanth Jayaprakash",2024
922438,tt12731104,Negative,02-01-2022,te,0,9,31,0,Bala Satish,"Dayanand Reddy, Vikram Shiva, Swetaa Varma",2022
922805,tt11468232,Yenni Thuniga,04-08-2022,ta,7,5.9,834,0,S. K. Vettri Selvan,"Jai Sampath, Athulya Ravi, Sunil, Vamsi Krishna, Vidhya Pradeep",2022
923003,tt16899852,My Dear Bootham,15-07-2022,ta,6,5.8,462,0,N. Ragavan,"Prabhu Deva, Remya Nambeesan, Ashwanth Ashokkumar, Samyuktha Karthik, Imman Annachi",2022
923035,tt23183388,Chaaver,22-09-2023,ml,5,6.2,2542,0,Tinu Pappachan,"Kunchacko Boban, Antony Varghese, Arjun Ashokan, Manoj K U, Anuroop P",2023
923767,tt13648270,Anbarivu,07-01-2022,ta,6.5,7.2,3708,0,Aswin Raam,"HipHop Tamizha Adhi, Napoleon, Kashmira Pardesi, Shivani Rajashekar, Sai Kumar",2022
924444,tt13684416,Suyetchai MLA,05-05-2006,ta,0,6,16,0,Guru Dhanapal,"Sathyaraj, Goundamani, Prakash Raj, Nassar, Rajan P Dev",2006
924506,tt16970840,Pen Vilai Verum 999 Rubai Matume,07-01-2022,ta,0,7,66,0,Varada raj,"Rajkamal, Sweta Pandit, Vadivel Balaji, KPY Ramar",2022
925640,tt2432682,Huduga Hudugi,12-11-2010,kn,0,6.3,33,0,Indrajit Lankesh,"Sammir Dattani, Lekha Washington, Sadha, Sanjjanaa Galrani, Anita Hassanandani Reddy",2010
925648,tt1643239,The Goa Run,10-12-2018,hi,0,7.4,73,0,John Owen,"Rajeev Khandelwal, Lekha Washington, Prashant Narayanan, Raj Singh Arora, Vibha Chibber",2018
925695,tt16429936,Sorry Bhaisaab,16-12-2021,hi,0,7.8,126,0,Sumit Ghildiyal,"Sharib Hashmi, Gauahar Khan, Jaspal Sharma, Sachin Kathuria, Khanica",2021
925818,tt14433712,Naai Sekar,13-01-2022,ta,6,4.8,549,0,Kishore Rajkumar,"Sathish, Pavithra Lakshmi, Shiva, Sriman, Livingston",2022
926027,tt15380500,Vasco Da Gama,02-08-2024,ta,4,5.5,5972,0,R.G. Krishnan,"Nakul, K. S. Ravikumar, Arthana Binu, Vamsi Krishna, Anandaraj",2024
926085,tt14934060,36 Farmhouse,21-01-2022,hi,4.667,3.8,572,0,Ram Ramesh Sharma,"Vijay Raaz, Sanjay Mishra, Amol Parashar, Barkha Singh, Ashwini Kalsekar",2022
926105,tt15654318,AGP,20-01-2022,ta,0,3.6,78,0,Ramesh Subramaniyan,"Lakshmi Menon, R. V. Bharathan",2022
926575,tt26303401,Philip's,01-12-2023,ml,6.714,7.1,884,0,Alfred Kurian Joseph,"Mukesh, Innocent, Noble Babu Thomas, Navani Devanand, Quinn Vipin",2023
926900,tt15478046,Thalainagaram 2,23-06-2023,ta,1.5,4,590,0,V. Z. Durai,"Sundar C, Palak Lalwani, Prabhakar, Thambi Ramaiah, Cheran Raj",2023
926985,tt16118660,Pattampoochi,24-06-2022,ta,7,4.9,326,0,Badri,"Sundar C, Jai Sampath, Honey Rose, Imman Annachi, Ajit Koshy",2022
926990,tt13569330,Mudhal Kanave,20-04-2007,ta,0,7.2,17,0,C Balamurugan,"Vikranth, Honey Rose, Santhanam, Karunas, Yugendran",2007
927213,tt14468904,Sathyam Mathrame Bodhippikku,14-01-2022,ml,5,3.8,246,0,Sagar Hari,"Dhyan Sreenivasan, Johny Antony, Sudheesh, Rony David Raj, Ambika",2022
927223,tt24787322,Gurudev Hoysala,30-03-2023,kn,5,6.6,1103,0,Vijay N,"Dhananjay, Naveen Shankar, Amrutha Iyengar, Nagabhushana N S, B. S. Avinash",2023
927547,tt32086077,All We Imagine as Light,21-09-2024,ml,6.835,7.1,13595,3010117,Payal Kapadia,"Kani Kusruti, Divya Prabha, Chhaya Kadam, Hridhu Haroon, Azees Nedumangad",2024
927670,tt10515868,Kathavarayan,30-05-2008,ta,0,4.5,11,0,Salangai Durai,"Karan, Vidisha Srivastava, Vadivelu, Radha, Kadhal Thandapani",2008
927917,tt17073540,White Rose,05-04-2024,ta,0,4.3,481,0,K Rajashekar,"Anandhi, R. K. Suresh, Rooso Sreedharan, Vijith, Baby Nakshatra",2024
928014,tt2574902,Ithramathram,14-09-2012,ml,4,6,15,0,K. Gopinathan,"Shweta Menon, Biju Menon, KPAC Lalitha, Nedumudi Venu, Anoop Chandran",2012
928017,tt12828808,Careebeyans,27-09-2013,ml,0,3.1,8,0,Irshad,"Kalabhavan Mani, Shweta Menon, Saikumar, Suman Talwar, Janardhanan",2013
928618,tt14806338,Stand Up Rahul,18-03-2022,te,7,5,999,0,Santo Mohan Veeranki,"Raj Tarun, Varsha Bollamma, Vennela Kishore, Murali Sharma, Indraja",2022
929837,tt17345904,Jackson Bazaar Youth,19-05-2023,ml,5.5,6.3,3349,0,Shamal Sulaiman,"Indrans, Chinnu Chandini Nair, Jaffer Idukki, Lukman Avaran, Abhiram Radhakrishnan",2023
930108,tt21370972,Ratham,06-10-2023,ta,6.333,6.3,829,0,C. S. Amudhan,"Vijay Antony, Mahima Nambiar, Remya Nambeesan, Nandita Swetha, Jagan Krishnan",2023
930136,tt19893706,Krishna Vrinda Vihari,23-09-2022,te,4.917,5.8,2619,0,Annish Krishna,"Naga Shaurya, Shirley Setia, Radikaa Sarathkumar, Vennela Kishore, Rahul Ramakrishna",2022
931132,tt22027654,Jaya Jaya Jaya Jaya Hey,28-10-2022,ml,7,7.7,7463,0,Vipin Das,"Darshana Rajendran, Basil Joseph, Aju Varghese, Azees Nedumangad, Sudheer Paravoor",2022
931194,tt11306982,Prithipal Singh...a Story,30-10-2015,hi,0,6,10,0,Babita Puri,"Anjali Singh, Deepak Sandhu, Baninderjit Singh, Vikas Kumar",2015
931201,tt6915090,Pavithra,07-06-2013,te,4.5,5.2,42,0,Janardhan Maharshi,"Shriya Saran, Roja Selvamani, Kaushik Babu, Sai Kumar, Shivaji",2013
931226,tt13353370,Thirimali,27-01-2022,ml,7.3,5.9,1175,0,Rajiv Shetty,"Bibin George, Johny Antony, Dharmajan Bolgatty, Hareesh Perumanna, Innocent",2022
931626,tt3053796,Neer Dose,02-09-2016,kn,3.5,7.5,417,0,Vijaya Prasad,"Jaggesh, Hariprriya, Suman Ranganathan, H. G. Dattatreya",2016
931714,tt2115324,Good Morning,11-11-2011,hi,1,7.6,8,0,Kabir Singh Chowdhry,"Manish Kumar, Sukhmani Malik, Emmanuel Singh, Happy Vij, Dolly Ahluwalia",2011
931895,tt17501658,Antakshari,22-04-2022,ml,7.143,6.5,1677,0,Vipin Das,"Saiju Kurup, Priyanka Nair, Sudhi Koppa, Vijay Babu, Shabareesh Varma",2022
931953,tt12077762,Huttu Habbada Shubhashayagalu,31-12-2021,kn,0,6.8,629,0,Nagraj Bethur,"Diganth Manchale, Kavitha Gowda, Chethan Gandharva, Madenuru Manu, Sujay Shastri",2021
932186,tt17508126,Narai Ezhuthum Suyasaritham,15-03-2015,ta,0,7.7,521,0,Manikandan,"Manikandan, Delhi Ganesh, Mirchi Vijay",2015
932263,tt27487415,Rajni,08-12-2023,ml,5.7,5.3,337,0,Vinil Scariah Varghese,"Kalidas Jayaram, Namitha Pramod, Saiju Kurup, Ashwin Kumar, Reba Monica John",2023
932289,tt17514144,3E,04-02-2022,te,9,8,1237,0,Vishwanath Batchu,"Tribuvan Reddy, Lavanya, Sherya Rajmohan, Rahul, Nikil Thatiparthy",2022
933057,tt6301436,Nine /10,26-01-2017,ml,7,8.4,18,0,Rohan Raj,"Sajesh Nambiar, Anand Gopinathan, Shabin TV, Ajay pv, Hareesh Peradi",2017
933109,tt12845262,Operation Olipporu,23-01-2021,ml,6,9,90,0,Akshay Ajayakumar,"Akhil S., Arjun R S, Ananthan G.T, Ajit Kumar, Ajoy Joseph",2021
933290,tt18079046,Bardovi,02-08-2024,hi,4,6.9,84,0,Karan Chavan,"Chittaranjan Giri, Chhaya Kadam, Virat Madake",2024
933476,tt17024164,Bhamakalapam,11-02-2022,te,6.7,6.3,738,0,Abhimanyu Tadimeti,"Priyamani, John Vijay, Saranya Pradeep, Pammi Sai, Shanthi Rao",2022
933699,tt27235852,Raid,10-11-2023,ta,2,3.1,1237,0,S.P. Karthi,"Vikram Prabhu, Sri Divya, Daniel Annie Pope, Rishi Rithvik, Ananthika Sanilkumar",2023
933833,tt17632818,Kooman,04-11-2022,ml,6.633,7.3,5057,0,Jeethu Joseph,"Asif Ali, Renji Panicker, Baburaj, Jaffer Idukki, Hannah Reji Koshy",2022
933835,tt21151596,Cup,27-09-2024,ml,2,8.3,109,0,Sanju V Samuel,"Mathew Thomas, Riya Shibu, Basil Joseph, Guru Somasundaram, Namitha Pramod",2024
934292,tt11355334,Pandrikku Nandri Solli,04-02-2022,ta,8,5.5,161,0,Bala Aran,"Nishanth Russo, Vijay Sathya, Nakkalites Chella, Joe Malloori, Balaji Rathinam",2022
934419,tt14428598,Qala,24-11-2022,hi,6.6,7.2,8489,0,Anvita Dutt,"Triptii Dimri, Swastika Mukherjee, Babil Khan, Amit Sial, Sameer Kochhar",2022
934878,tt15964308,Sherdil: The Pilibhit Saga,24-06-2022,hi,5.8,6.5,3064,0,Srijit Mukherji,"Pankaj Tripathi, Sayani Gupta, Neeraj Kabi, Masood Akhtar, Akshay Kapoor",2022
935520,tt15302546,Panthrand,24-06-2022,ml,5.7,6,732,0,Leo Thaddeus,"Shine Tom Chacko, Dev Mohan, Vinayakan, Lal, Srindaa",2022
935552,tt11737778,Anbulla Ghilli,06-02-2022,ta,0,7.1,58,0,Srinath Ramalingam,"Maithreya Rajasekar, Soori, Dushara Vijayan, Chandhini Tamilarasan, Ilavarasu",2022
936229,tt27621015,Shastry Viruddh Shastry,03-11-2023,hi,5.8,6.9,2424,0,Shiboprosad Mukherjee,"Shiv Panditt, Paresh Rawal, Nina Kulkarni, Mimi Chakraborty, Manoj Joshi",2023
936622,tt18072316,Bade Miyan Chote Miyan,11-04-2024,hi,6.333,3.7,40696,12018000,Ali Abbas Zafar,"Akshay Kumar, Tiger Shroff, Sonakshi Sinha, Manushi Chhillar, Alaya F",2024
936665,tt14433692,Dilli Kaand,24-09-2021,hi,0,5.9,13,0,Unknown,Unknown,2021
937053,tt18250130,Neymar,12-05-2023,ml,4.714,6.5,2300,0,Sudhi Maddison,"Mathew Thomas, Naslen K. Gafoor, Amala Rose, Vijayaraghavan, Shammi Thilakan",2023
937323,tt14137346,Priyan Ottathilaanu,24-06-2022,ml,7.222,6.9,2243,0,Antony Sony,"Sharafudheen, Nyla Usha, Aparna Das, Biju Sopanam, Sudhi Koppa",2022
937331,tt18071828,Koorman,11-02-2022,ta,8,4.6,183,0,Bryan Biju George,"Rajaji Manickam, Janani Iyer, Balasaravanan, Aadukalam Naren, Gautham Vasudev Menon",2022
937702,tt15415924,Agilan,10-03-2023,ta,4,4.2,857,0,N. Kalyanakrishnan,"Ravi Mohan, Priya Bhavani Shankar, Tanya Ravichandran, Chirag Jani, Hareesh Peradi",2023
938497,tt11531610,Oh Meri Laila,23-12-2022,ml,5,5,726,0,Abhishek K.S,"Antony Varghese, Kichu Tellus, Nandana Rajan, Sona Olickal, Sivakami Anantha Narayan",2022
938551,tt28337815,Somante Krithavu,06-10-2023,ml,5.25,6,903,0,Rohith Narayanan,"Vinay Forrt, Fara Shibla, Seema G Nair, Jayan Cherthala, Bipin Chandran",2023
938674,tt6278278,Goddesses,01-06-2007,ta,7,5.8,21,0,Leena Manimekalai,Unknown,2007
938676,tt2243336,Aalaap,27-07-2012,hi,0,6.2,38,0,Manish Manikpuri,"Amit Purohit, Abhimanyu Singh, Vijay Raaz, Murali Sharma, Rituparna Sengupta",2012
938678,tt5103932,I Am Yet to See Delhi,09-10-2015,hi,0,5,27,0,Humaira Bilkis,Humaira Bilkis,2015
938759,tt3175440,Huff! It's Too Much,25-10-2013,hi,0,5.8,27,0,Unknown,Unknown,2013
938826,tt18377936,Bloody Mary,15-04-2022,te,5.3,6,316,0,Chandoo Mondeti,"Nivetha Pethuraj, Kireeti Damaraju, Brahmaji, Ajay, Rajkumar Kasireddy",2022
938890,tt21946058,Hunt,26-01-2023,te,3.833,5.3,2798,0,Mahesh Surapaneni,"Sudheer Babu, Srikanth, Bharath Srinivasan, Mime Gopi, Mounika Reddy",2023
938898,tt14166170,Pyaar Mein Aisa Hota Hai,13-01-2013,hi,0,4.4,8,0,Unknown,Unknown,2013
938908,tt2234328,Siyaah..,11-07-2012,hi,0,5.4,78,0,Unknown,Unknown,2012
939423,tt15832148,Afwaah,05-05-2023,hi,5.9,5.7,4743,0,Sudhir Mishra,"Nawazuddin Siddiqui, Bhumi Pednekar, Sumeet Vyas, Sharib Hashmi, Sumit Kaul",2023
939500,tt20836390,Kochaal,10-06-2022,ml,6.5,6.7,382,0,Shyam Mohan,"Krishna Shankar, Chaitanya Pratap, Murali Gopy, Shine Tom Chacko, Indrans",2022
939537,tt11841830,Black Rose,01-10-2020,hi,0,4,123,0,Hemant Mishra,"Samiksha Bhatnagar, Rahul Chawla, Abhilash Dada, Amit Gupta",2020
940821,tt17497760,The Charnel House,04-03-2022,ml,0,8.3,19,0,Nidhin R Nath,"Vaisakh Kuttikrishnan, Vikas Krishnan, Ganesh Bhat, Vishnu Harikumar",2022
941596,tt14479746,Thar,06-05-2022,hi,5.9,6.1,8333,0,Raj Singh Chaudhary,"Anil Kapoor, Harshvardhan Kapoor, Fatima Sana Shaikh, Satish Kaushik, Jitendra Joshi",2022
942053,tt9389984,Apple Cake,23-11-2018,kn,0,6.9,18,0,Ranjith Kumar Gowda,"Ranjith Kumar Gowda, Arvind Kumar Gowda, Krishna Hanagi, Shubha Raksha, Vijay Shankar",2018
942411,tt27032419,Mrs.,17-11-2023,hi,6.5,6.7,6012,0,Arati Kadav,"Sanya Malhotra, Nishant Dahiya, Kanwaljit Singh, Aparna Ghoshal, Mrinal Kulkarni",2023
942561,tt21836384,Ghudchadi,09-08-2024,hi,2,4.1,600,0,Binnoy Gandhi,"Sanjay Dutt, Raveena Tandon, Khushali Kumar, Parth Samthaan, Aruna Irani",2024
